date,year,month,day,hour,load,wind_gen,solar_gen,co2
1/1/2021,2021,1,1,0,44084,13924,0,19333
1/1/2021,2021,1,1,1,43445,14046,0,18727
1/1/2021,2021,1,1,2,43129,14473,0,18377
1/1/2021,2021,1,1,3,42988,14060,0,18444
1/1/2021,2021,1,1,4,43189,12590,0,19144
1/1/2021,2021,1,1,5,43592,12013,0,20425
1/1/2021,2021,1,1,6,44627,10952,0,21206
1/1/2021,2021,1,1,7,45580,10690,0,22088
1/1/2021,2021,1,1,8,45974,9959,60,22578
1/1/2021,2021,1,1,9,45905,9693,1310,21718
1/1/2021,2021,1,1,10,45775,10486,2327,20387
1/1/2021,2021,1,1,11,45351,11152,2775,19725
1/1/2021,2021,1,1,12,44659,10736,2780,19543
1/1/2021,2021,1,1,13,43720,9225,2879,19565
1/1/2021,2021,1,1,14,42760,8112,2496,20096
1/1/2021,2021,1,1,15,42103,6516,2579,21105
1/1/2021,2021,1,1,16,41949,5033,2450,23740
1/1/2021,2021,1,1,17,43086,3587,834,26637
1/1/2021,2021,1,1,18,45737,3310,0,27662
1/1/2021,2021,1,1,19,46388,3711,0,27307
1/1/2021,2021,1,1,20,46021,3466,0,26982
1/1/2021,2021,1,1,21,45707,3722,0,26724
1/1/2021,2021,1,1,22,44989,3585,0,25844
1/1/2021,2021,1,1,23,43594,4639,0,24789
1/1/2022,2022,1,1,0,38124,12067,0,18261
1/1/2022,2022,1,1,1,37122,12884,0,17226
1/1/2022,2022,1,1,2,35936,14366,0,15582
1/1/2022,2022,1,1,3,35132,16463,0,13616
1/1/2022,2022,1,1,4,34602,18337,0,12451
1/1/2022,2022,1,1,5,34450,18162,0,12668
1/1/2022,2022,1,1,6,34571,18538,0,12908
1/1/2022,2022,1,1,7,34634,18307,7,12892
1/1/2022,2022,1,1,8,35603,17299,1343,13080
1/1/2022,2022,1,1,9,37914,16916,3458,13548
1/1/2022,2022,1,1,10,39986,17691,3243,14402
1/1/2022,2022,1,1,11,41833,17781,2691,16150
1/1/2022,2022,1,1,12,43161,16339,3589,17416
1/1/2022,2022,1,1,13,44005,14858,4741,18109
1/1/2022,2022,1,1,14,44248,14037,5070,18467
1/1/2022,2022,1,1,15,44207,14345,4631,18406
1/1/2022,2022,1,1,16,44336,16891,2012,18286
1/1/2022,2022,1,1,17,44981,18793,231,18439
1/1/2022,2022,1,1,18,46107,19858,0,18805
1/1/2022,2022,1,1,19,45944,20442,0,18028
1/1/2022,2022,1,1,20,45758,20859,0,17481
1/1/2022,2022,1,1,21,45518,21379,0,16700
1/1/2022,2022,1,1,22,44806,21760,0,16052
1/1/2023,2023,1,1,0,35829,21753,0,10961
1/1/2023,2023,1,1,1,35245,21570,0,10752
1/1/2023,2023,1,1,2,34599,21036,0,10794
1/1/2023,2023,1,1,3,34227,20595,0,10851
1/1/2023,2023,1,1,4,34093,20387,0,10876
1/1/2023,2023,1,1,5,34256,20057,0,10968
1/1/2023,2023,1,1,6,34747,19481,0,11602
1/1/2023,2023,1,1,7,35260,17942,41,12708
1/1/2023,2023,1,1,8,35986,16437,1251,13420
1/1/2023,2023,1,1,9,36670,13976,4559,13622
1/1/2023,2023,1,1,10,36898,10277,6094,15015
1/1/2023,2023,1,1,11,37254,9406,6107,15792
1/1/2023,2023,1,1,12,37761,9701,6355,15923
1/1/2023,2023,1,1,13,38076,8285,6433,16604
1/1/2023,2023,1,1,14,38768,7609,6460,17223
1/1/2023,2023,1,1,15,39557,8444,5359,17508
1/1/2023,2023,1,1,16,39785,9372,2615,18454
1/1/2023,2023,1,1,17,40468,10977,325,18987
1/1/2023,2023,1,1,18,41843,16129,0,17165
1/1/2023,2023,1,1,19,41403,20218,0,14886
1/1/2023,2023,1,1,20,40940,21557,0,14323
1/1/2023,2023,1,1,21,40171,22515,0,13504
1/1/2023,2023,1,1,22,39040,23885,0,12473
1/1/2023,2023,1,1,23,36650,22017,0,11714
1/1/2024,2024,1,1,0,41370,14826,0,17810
1/1/2024,2024,1,1,1,41631,13892,0,18195
1/1/2024,2024,1,1,2,41567,12973,0,18534
1/1/2024,2024,1,1,3,41536,11974,0,18987
1/1/2024,2024,1,1,4,42224,10799,0,20239
1/1/2024,2024,1,1,5,43240,8720,0,22451
1/1/2024,2024,1,1,6,44552,6656,0,24267
1/1/2024,2024,1,1,7,45323,5164,84,25490
1/1/2024,2024,1,1,8,46180,3316,3023,25294
1/1/2024,2024,1,1,9,46495,2016,7917,23400
1/1/2024,2024,1,1,10,46710,1540,9498,23207
1/1/2024,2024,1,1,11,46344,1801,10137,22198
1/1/2024,2024,1,1,12,45615,2002,10429,21003
1/1/2024,2024,1,1,13,44594,2056,10831,19386
1/1/2024,2024,1,1,14,44133,2198,11222,18385
1/1/2024,2024,1,1,15,44005,2717,11241,17835
1/1/2024,2024,1,1,16,44379,3390,7289,20158
1/1/2024,2024,1,1,17,46886,5076,927,24418
1/1/2024,2024,1,1,18,49044,6688,0,25351
1/1/2024,2024,1,1,19,49254,7502,0,25486
1/1/2024,2024,1,1,20,49452,7942,0,25264
1/1/2024,2024,1,1,21,49015,8100,0,24861
1/1/2024,2024,1,1,22,48130,8525,0,24164
1/1/2024,2024,1,1,23,41681,15869,0,22895
1/10/2021,2021,1,10,0,40929,11565,0,21457
1/10/2021,2021,1,10,1,40216,10110,0,20849
1/10/2021,2021,1,10,2,39659,11306,0,19734
1/10/2021,2021,1,10,3,39396,11449,0,20065
1/10/2021,2021,1,10,4,39506,11242,0,20634
1/10/2021,2021,1,10,5,40002,10583,0,22072
1/10/2021,2021,1,10,6,41129,9660,0,23035
1/10/2021,2021,1,10,7,42697,8293,0,24428
1/10/2021,2021,1,10,8,44431,8182,4,25868
1/10/2021,2021,1,10,9,46686,8008,100,26670
1/10/2021,2021,1,10,10,48773,8372,324,27151
1/10/2021,2021,1,10,11,50173,9212,623,27557
1/10/2021,2021,1,10,12,51538,9191,683,27859
1/10/2021,2021,1,10,13,52320,8755,753,27899
1/10/2021,2021,1,10,14,52321,8436,942,27943
1/10/2021,2021,1,10,15,52426,8522,878,28286
1/10/2021,2021,1,10,16,52499,8150,663,28677
1/10/2021,2021,1,10,17,53333,7855,301,29213
1/10/2021,2021,1,10,18,55206,7974,5,29885
1/10/2021,2021,1,10,19,55244,7754,0,29924
1/10/2021,2021,1,10,20,54639,7982,0,29311
1/10/2021,2021,1,10,21,53154,8237,0,28284
1/10/2021,2021,1,10,22,51160,7770,0,27490
1/10/2021,2021,1,10,23,49021,7414,0,26620
1/10/2022,2022,1,10,0,39499,14762,0,18985
1/10/2022,2022,1,10,1,39198,14378,0,19095
1/10/2022,2022,1,10,2,39391,14042,0,19361
1/10/2022,2022,1,10,3,39932,13754,0,20017
1/10/2022,2022,1,10,4,41281,11788,0,21350
1/10/2022,2022,1,10,5,44192,11332,0,23070
1/10/2022,2022,1,10,6,48469,11091,0,24844
1/10/2022,2022,1,10,7,51015,9452,32,27060
1/10/2022,2022,1,10,8,51100,7907,1060,26950
1/10/2022,2022,1,10,9,49914,6390,3011,26418
1/10/2022,2022,1,10,10,48423,5433,3732,25936
1/10/2022,2022,1,10,11,46700,4814,4581,25127
1/10/2022,2022,1,10,12,45106,4086,4635,24653
1/10/2022,2022,1,10,13,43844,3902,4683,24047
1/10/2022,2022,1,10,14,42628,3880,4835,23140
1/10/2022,2022,1,10,15,41986,3662,3865,23351
1/10/2022,2022,1,10,16,42593,3133,2649,24250
1/10/2022,2022,1,10,17,44778,2771,402,26003
1/10/2022,2022,1,10,18,47515,3287,0,27252
1/10/2022,2022,1,10,19,47867,4591,0,26540
1/10/2022,2022,1,10,20,47796,5271,0,25935
1/10/2022,2022,1,10,21,46937,5894,0,25005
1/10/2022,2022,1,10,22,45136,6268,0,23733
1/10/2022,2022,1,10,23,40599,15351,0,22188
1/10/2023,2023,1,10,0,36165,16805,0,13274
1/10/2023,2023,1,10,1,35554,18356,0,12275
1/10/2023,2023,1,10,2,35234,18705,0,12123
1/10/2023,2023,1,10,3,35382,18997,0,12305
1/10/2023,2023,1,10,4,36267,19807,0,12437
1/10/2023,2023,1,10,5,38315,19910,0,13526
1/10/2023,2023,1,10,6,41601,20358,0,14727
1/10/2023,2023,1,10,7,42987,20167,38,15315
1/10/2023,2023,1,10,8,42719,19123,1986,14948
1/10/2023,2023,1,10,9,42233,16451,5219,14349
1/10/2023,2023,1,10,10,41883,15097,7375,14210
1/10/2023,2023,1,10,11,41791,15559,7701,13647
1/10/2023,2023,1,10,12,42043,16957,6464,13536
1/10/2023,2023,1,10,13,42813,18035,5719,13743
1/10/2023,2023,1,10,14,43385,18260,5512,14236
1/10/2023,2023,1,10,15,44020,17741,5442,14894
1/10/2023,2023,1,10,16,44360,16942,4302,15421
1/10/2023,2023,1,10,17,44246,15649,804,17445
1/10/2023,2023,1,10,18,44845,17984,0,17038
1/10/2023,2023,1,10,19,44613,21170,0,15377
1/10/2023,2023,1,10,20,43572,22928,0,14195
1/10/2023,2023,1,10,21,41922,22774,0,13639
1/10/2023,2023,1,10,22,39695,22526,0,12636
1/10/2023,2023,1,10,23,37461,15121,0,11791
1/10/2024,2024,1,10,0,51556,23210,0,17139
1/10/2024,2024,1,10,1,51187,23786,0,16659
1/10/2024,2024,1,10,2,51207,24378,0,16322
1/10/2024,2024,1,10,3,51863,24615,0,16791
1/10/2024,2024,1,10,4,53167,24992,0,17541
1/10/2024,2024,1,10,5,55924,25317,0,19139
1/10/2024,2024,1,10,6,59902,25572,0,21722
1/10/2024,2024,1,10,7,60977,25623,159,22346
1/10/2024,2024,1,10,8,58906,24247,4306,19579
1/10/2024,2024,1,10,9,55692,21210,9749,16005
1/10/2024,2024,1,10,10,52848,19931,11328,14283
1/10/2024,2024,1,10,11,50462,20337,10769,13226
1/10/2024,2024,1,10,12,48439,20014,9354,13027
1/10/2024,2024,1,10,13,46805,18503,9171,13006
1/10/2024,2024,1,10,14,45627,16713,9393,13430
1/10/2024,2024,1,10,15,44979,14770,9244,14158
1/10/2024,2024,1,10,16,44686,12493,7429,15538
1/10/2024,2024,1,10,17,46154,10101,1586,20305
1/10/2024,2024,1,10,18,48360,9772,16,23675
1/10/2024,2024,1,10,19,48649,10411,0,24199
1/10/2024,2024,1,10,20,48496,12140,0,23362
1/10/2024,2024,1,10,21,47683,13902,0,21608
1/10/2024,2024,1,10,22,45975,14615,0,19958
1/10/2024,2024,1,10,23,52045,20476,0,18684
1/11/2021,2021,1,11,0,47198,7248,0,25852
1/11/2021,2021,1,11,1,46253,7027,0,25718
1/11/2021,2021,1,11,2,45793,6162,0,26494
1/11/2021,2021,1,11,3,45635,5084,0,26984
1/11/2021,2021,1,11,4,46458,4598,0,27707
1/11/2021,2021,1,11,5,48026,4673,0,28538
1/11/2021,2021,1,11,6,50944,4888,0,30136
1/11/2021,2021,1,11,7,54348,4417,0,31246
1/11/2021,2021,1,11,8,55681,4661,29,31543
1/11/2021,2021,1,11,9,55482,4687,947,30821
1/11/2021,2021,1,11,10,54387,4846,1789,29916
1/11/2021,2021,1,11,11,53255,4541,2210,29348
1/11/2021,2021,1,11,12,51583,3891,2201,28777
1/11/2021,2021,1,11,13,49896,3358,2308,27797
1/11/2021,2021,1,11,14,48476,3143,2354,26865
1/11/2021,2021,1,11,15,47173,2706,2235,26992
1/11/2021,2021,1,11,16,46948,2141,1832,27976
1/11/2021,2021,1,11,17,47943,1935,759,29099
1/11/2021,2021,1,11,18,51361,2155,2,30374
1/11/2021,2021,1,11,19,52574,2475,0,30306
1/11/2021,2021,1,11,20,52570,2672,0,30384
1/11/2021,2021,1,11,21,52130,2908,0,29852
1/11/2021,2021,1,11,22,50934,3273,0,29053
1/11/2021,2021,1,11,23,48882,3239,0,28113
1/11/2022,2022,1,11,0,42581,7503,0,20970
1/11/2022,2022,1,11,1,42458,9077,0,20352
1/11/2022,2022,1,11,2,42623,9915,0,20045
1/11/2022,2022,1,11,3,43287,10436,0,20264
1/11/2022,2022,1,11,4,44410,10034,0,20911
1/11/2022,2022,1,11,5,47285,9855,0,22890
1/11/2022,2022,1,11,6,51245,10226,0,24760
1/11/2022,2022,1,11,7,53119,10714,43,25650
1/11/2022,2022,1,11,8,52286,10034,980,25265
1/11/2022,2022,1,11,9,50442,8532,3043,24214
1/11/2022,2022,1,11,10,48648,8687,3868,22959
1/11/2022,2022,1,11,11,47395,10233,4813,21304
1/11/2022,2022,1,11,12,46193,10273,4971,20148
1/11/2022,2022,1,11,13,45223,10907,4951,18970
1/11/2022,2022,1,11,14,44489,11422,5367,18165
1/11/2022,2022,1,11,15,44429,10577,5105,18759
1/11/2022,2022,1,11,16,45229,8841,3166,21222
1/11/2022,2022,1,11,17,46879,7280,666,23845
1/11/2022,2022,1,11,18,48354,8869,2,24224
1/11/2022,2022,1,11,19,48181,11670,0,22823
1/11/2022,2022,1,11,20,47689,13781,0,21647
1/11/2022,2022,1,11,21,46239,14256,0,20908
1/11/2022,2022,1,11,22,43871,14165,0,20041
1/11/2022,2022,1,11,23,43626,6916,0,18383
1/11/2023,2023,1,11,0,35643,21499,0,11291
1/11/2023,2023,1,11,1,34726,20888,0,11036
1/11/2023,2023,1,11,2,34222,20161,0,11062
1/11/2023,2023,1,11,3,34079,19733,0,11232
1/11/2023,2023,1,11,4,34675,19540,0,11596
1/11/2023,2023,1,11,5,36392,19586,0,12200
1/11/2023,2023,1,11,6,39816,19747,0,13869
1/11/2023,2023,1,11,7,41500,20134,51,15221
1/11/2023,2023,1,11,8,41927,21255,2294,13841
1/11/2023,2023,1,11,9,42234,19585,5333,13096
1/11/2023,2023,1,11,10,42712,17766,5732,13284
1/11/2023,2023,1,11,11,43436,19069,6323,12910
1/11/2023,2023,1,11,12,44818,21372,6662,12321
1/11/2023,2023,1,11,13,45491,22641,5452,12536
1/11/2023,2023,1,11,14,45935,22480,4764,12981
1/11/2023,2023,1,11,15,46367,22538,4450,13070
1/11/2023,2023,1,11,16,46816,23688,3027,13299
1/11/2023,2023,1,11,17,46987,24881,585,13797
1/11/2023,2023,1,11,18,47672,25460,0,13951
1/11/2023,2023,1,11,19,47119,26000,0,13481
1/11/2023,2023,1,11,20,45996,26073,0,12898
1/11/2023,2023,1,11,21,44286,25461,0,12502
1/11/2023,2023,1,11,22,41835,25342,0,11134
1/11/2023,2023,1,11,23,37413,21946,0,10196
1/11/2024,2024,1,11,0,42733,15504,0,17383
1/11/2024,2024,1,11,1,42484,16428,0,16332
1/11/2024,2024,1,11,2,42719,17448,0,15659
1/11/2024,2024,1,11,3,43614,18481,0,15593
1/11/2024,2024,1,11,4,44634,18486,0,16175
1/11/2024,2024,1,11,5,47408,19709,0,17284
1/11/2024,2024,1,11,6,51325,20151,0,19678
1/11/2024,2024,1,11,7,52739,21428,89,19805
1/11/2024,2024,1,11,8,51692,21593,3253,17245
1/11/2024,2024,1,11,9,49927,18383,8176,15291
1/11/2024,2024,1,11,10,48131,16619,10666,14154
1/11/2024,2024,1,11,11,46613,17890,8890,13663
1/11/2024,2024,1,11,12,45367,19177,6307,13583
1/11/2024,2024,1,11,13,44990,20389,4937,13540
1/11/2024,2024,1,11,14,44939,20537,4526,13595
1/11/2024,2024,1,11,15,44884,20992,3869,13681
1/11/2024,2024,1,11,16,45527,21520,3241,14045
1/11/2024,2024,1,11,17,46767,22536,1017,15163
1/11/2024,2024,1,11,18,48125,21643,146,17182
1/11/2024,2024,1,11,19,47831,22799,145,16241
1/11/2024,2024,1,11,20,47188,24953,146,14755
1/11/2024,2024,1,11,21,45768,23444,126,14716
1/11/2024,2024,1,11,22,43846,22778,0,14227
1/11/2024,2024,1,11,23,44020,15028,0,14153
1/12/2021,2021,1,12,0,47716,4137,0,27162
1/12/2021,2021,1,12,1,47360,4571,0,26893
1/12/2021,2021,1,12,2,47463,4690,0,27027
1/12/2021,2021,1,12,3,47999,4897,0,27401
1/12/2021,2021,1,12,4,49011,5196,0,28198
1/12/2021,2021,1,12,5,50802,5615,0,29247
1/12/2021,2021,1,12,6,54208,6611,0,30777
1/12/2021,2021,1,12,7,57848,6803,0,32043
1/12/2021,2021,1,12,8,58423,6064,85,31443
1/12/2021,2021,1,12,9,55714,5659,1997,30036
1/12/2021,2021,1,12,10,52932,3958,3551,29420
1/12/2021,2021,1,12,11,50096,2930,3576,28491
1/12/2021,2021,1,12,12,47993,2556,3527,27172
1/12/2021,2021,1,12,13,46029,2780,3671,25966
1/12/2021,2021,1,12,14,44690,2362,3770,25405
1/12/2021,2021,1,12,15,43815,1858,3897,25174
1/12/2021,2021,1,12,16,43901,1655,3819,26035
1/12/2021,2021,1,12,17,45086,1370,2020,27866
1/12/2021,2021,1,12,18,48365,1944,22,28401
1/12/2021,2021,1,12,19,49268,3760,0,27497
1/12/2021,2021,1,12,20,49328,6223,0,26543
1/12/2021,2021,1,12,21,48911,8316,0,25469
1/12/2021,2021,1,12,22,47519,9828,0,23338
1/12/2021,2021,1,12,23,45557,12190,0,21402
1/12/2022,2022,1,12,0,40485,13786,0,18063
1/12/2022,2022,1,12,1,39892,12965,0,18762
1/12/2022,2022,1,12,2,39591,12343,0,19107
1/12/2022,2022,1,12,3,39939,11457,0,19879
1/12/2022,2022,1,12,4,41039,10226,0,21106
1/12/2022,2022,1,12,5,43519,8858,0,23170
1/12/2022,2022,1,12,6,47062,8092,0,25032
1/12/2022,2022,1,12,7,49037,6881,12,26302
1/12/2022,2022,1,12,8,48660,5986,1904,25910
1/12/2022,2022,1,12,9,47404,3792,5700,24648
1/12/2022,2022,1,12,10,46086,2479,6257,24117
1/12/2022,2022,1,12,11,44536,1983,6260,23624
1/12/2022,2022,1,12,12,43007,2003,6108,23101
1/12/2022,2022,1,12,13,41592,2334,6292,22223
1/12/2022,2022,1,12,14,40602,1843,6485,21874
1/12/2022,2022,1,12,15,40217,1170,6764,22002
1/12/2022,2022,1,12,16,40550,791,5490,23149
1/12/2022,2022,1,12,17,42033,867,1358,24993
1/12/2022,2022,1,12,18,44102,861,0,26842
1/12/2022,2022,1,12,19,44226,1055,0,27179
1/12/2022,2022,1,12,20,43993,1216,0,26966
1/12/2022,2022,1,12,21,43106,1216,0,26422
1/12/2022,2022,1,12,22,41406,1301,0,25727
1/12/2022,2022,1,12,23,41759,14188,0,24470
1/12/2023,2023,1,12,0,37453,23637,0,9633
1/12/2023,2023,1,12,1,36212,22608,0,9405
1/12/2023,2023,1,12,2,35568,22468,0,9299
1/12/2023,2023,1,12,3,35502,22162,0,9471
1/12/2023,2023,1,12,4,36164,22055,0,9758
1/12/2023,2023,1,12,5,38227,23432,0,10061
1/12/2023,2023,1,12,6,41718,24204,0,11628
1/12/2023,2023,1,12,7,43456,24721,102,12447
1/12/2023,2023,1,12,8,43720,23839,2159,12060
1/12/2023,2023,1,12,9,43861,23774,4120,11561
1/12/2023,2023,1,12,10,43656,24333,4046,11104
1/12/2023,2023,1,12,11,43176,24003,4055,11079
1/12/2023,2023,1,12,12,42735,23151,4310,11404
1/12/2023,2023,1,12,13,42353,22055,4724,12105
1/12/2023,2023,1,12,14,42010,20649,4791,12823
1/12/2023,2023,1,12,15,41913,18447,4954,13684
1/12/2023,2023,1,12,16,42148,16118,4377,14517
1/12/2023,2023,1,12,17,43527,12689,1479,17893
1/12/2023,2023,1,12,18,45527,9992,2,21425
1/12/2023,2023,1,12,19,45745,9171,0,22204
1/12/2023,2023,1,12,20,45561,7997,0,22647
1/12/2023,2023,1,12,21,44733,7392,0,22698
1/12/2023,2023,1,12,22,42926,6863,0,22247
1/12/2023,2023,1,12,23,39376,24621,0,21328
1/12/2024,2024,1,12,0,39690,19857,0,13966
1/12/2024,2024,1,12,1,38806,19190,0,13869
1/12/2024,2024,1,12,2,38244,18463,0,13886
1/12/2024,2024,1,12,3,39122,19356,0,13938
1/12/2024,2024,1,12,4,41201,21172,0,14114
1/12/2024,2024,1,12,5,44835,24425,0,14457
1/12/2024,2024,1,12,6,49246,24102,0,16697
1/12/2024,2024,1,12,7,52188,21950,122,19536
1/12/2024,2024,1,12,8,53434,20187,3978,19174
1/12/2024,2024,1,12,9,53258,18998,9973,16717
1/12/2024,2024,1,12,10,53014,19854,11440,15393
1/12/2024,2024,1,12,11,52139,20491,10934,14810
1/12/2024,2024,1,12,12,51162,20534,9986,14800
1/12/2024,2024,1,12,13,50068,20712,8416,15100
1/12/2024,2024,1,12,14,49078,20001,7940,15345
1/12/2024,2024,1,12,15,48545,18823,7568,16080
1/12/2024,2024,1,12,16,48690,15922,6698,17407
1/12/2024,2024,1,12,17,50375,9401,1753,23405
1/12/2024,2024,1,12,18,53326,5334,2,28789
1/12/2024,2024,1,12,19,54225,4769,0,29473
1/12/2024,2024,1,12,20,54688,5947,0,28889
1/12/2024,2024,1,12,21,54583,6676,0,28472
1/12/2024,2024,1,12,22,53996,8348,0,27742
1/12/2024,2024,1,12,23,41629,20982,0,26103
1/13/2021,2021,1,13,0,44411,13472,0,19986
1/13/2021,2021,1,13,1,44044,14630,0,19835
1/13/2021,2021,1,13,2,44264,14793,0,20323
1/13/2021,2021,1,13,3,44937,14481,0,21541
1/13/2021,2021,1,13,4,46130,13928,0,23351
1/13/2021,2021,1,13,5,48414,13410,0,24919
1/13/2021,2021,1,13,6,51892,13617,0,25915
1/13/2021,2021,1,13,7,55725,14385,0,26917
1/13/2021,2021,1,13,8,56056,13884,108,25966
1/13/2021,2021,1,13,9,53315,12870,2804,24202
1/13/2021,2021,1,13,10,49964,10272,4049,23769
1/13/2021,2021,1,13,11,46991,8398,3951,23219
1/13/2021,2021,1,13,12,44311,7751,3943,22075
1/13/2021,2021,1,13,13,42166,8592,3754,20296
1/13/2021,2021,1,13,14,40365,9125,4106,18773
1/13/2021,2021,1,13,15,39397,10333,4132,18047
1/13/2021,2021,1,13,16,39158,10926,4017,18630
1/13/2021,2021,1,13,17,39574,10713,2056,21361
1/13/2021,2021,1,13,18,42589,12140,27,21599
1/13/2021,2021,1,13,19,44264,15115,0,20671
1/13/2021,2021,1,13,20,44604,17378,0,20655
1/13/2021,2021,1,13,21,44434,18504,0,20091
1/13/2021,2021,1,13,22,43067,18976,0,17933
1/13/2021,2021,1,13,23,41408,19452,0,16534
1/13/2022,2022,1,13,0,39046,2369,0,23213
1/13/2022,2022,1,13,1,38728,2951,0,22814
1/13/2022,2022,1,13,2,39028,2947,0,23188
1/13/2022,2022,1,13,3,39680,3049,0,23640
1/13/2022,2022,1,13,4,41067,3455,0,24072
1/13/2022,2022,1,13,5,43788,4569,0,25822
1/13/2022,2022,1,13,6,47699,5236,0,27013
1/13/2022,2022,1,13,7,49590,5275,57,27819
1/13/2022,2022,1,13,8,48318,4807,2591,26223
1/13/2022,2022,1,13,9,45834,2641,6598,24315
1/13/2022,2022,1,13,10,43643,703,7001,23988
1/13/2022,2022,1,13,11,41887,401,6715,23469
1/13/2022,2022,1,13,12,40696,366,6473,23029
1/13/2022,2022,1,13,13,40133,314,6533,22770
1/13/2022,2022,1,13,14,39811,457,6739,22366
1/13/2022,2022,1,13,15,39786,389,6880,22203
1/13/2022,2022,1,13,16,40044,309,5681,22803
1/13/2022,2022,1,13,17,40643,439,1444,24904
1/13/2022,2022,1,13,18,42034,790,3,25495
1/13/2022,2022,1,13,19,41815,1266,0,25270
1/13/2022,2022,1,13,20,41231,2228,0,24549
1/13/2022,2022,1,13,21,40274,3949,0,23225
1/13/2022,2022,1,13,22,38613,6255,0,21055
1/13/2022,2022,1,13,23,39885,1815,0,19048
1/13/2023,2023,1,13,0,40453,6539,0,20791
1/13/2023,2023,1,13,1,40100,6226,0,20831
1/13/2023,2023,1,13,2,40188,6092,0,21089
1/13/2023,2023,1,13,3,40630,6030,0,21147
1/13/2023,2023,1,13,4,42012,6316,0,21385
1/13/2023,2023,1,13,5,44820,6466,0,22542
1/13/2023,2023,1,13,6,49023,6938,0,23887
1/13/2023,2023,1,13,7,51419,7412,146,24646
1/13/2023,2023,1,13,8,50504,6314,3899,23378
1/13/2023,2023,1,13,9,48480,3992,9084,21065
1/13/2023,2023,1,13,10,46514,3831,9556,20529
1/13/2023,2023,1,13,11,44473,4306,9127,19389
1/13/2023,2023,1,13,12,42857,4004,8893,18648
1/13/2023,2023,1,13,13,42029,3756,9100,18116
1/13/2023,2023,1,13,14,41213,3786,9468,17733
1/13/2023,2023,1,13,15,40840,3710,9645,17329
1/13/2023,2023,1,13,16,40985,4088,7500,18007
1/13/2023,2023,1,13,17,42335,4803,1679,20838
1/13/2023,2023,1,13,18,44140,7642,3,21106
1/13/2023,2023,1,13,19,44487,11466,0,18912
1/13/2023,2023,1,13,20,44888,14666,0,17630
1/13/2023,2023,1,13,21,44976,17183,0,16472
1/13/2023,2023,1,13,22,44435,19243,0,15469
1/13/2023,2023,1,13,23,41355,6703,0,14546
1/13/2024,2024,1,13,0,51815,13774,0,24700
1/13/2024,2024,1,13,1,51717,16133,0,23674
1/13/2024,2024,1,13,2,51949,18388,0,22296
1/13/2024,2024,1,13,3,51922,18760,0,21947
1/13/2024,2024,1,13,4,52714,19136,0,22286
1/13/2024,2024,1,13,5,54020,20265,0,22495
1/13/2024,2024,1,13,6,55836,21614,0,22945
1/13/2024,2024,1,13,7,57437,22779,205,23645
1/13/2024,2024,1,13,8,57267,23144,3537,21253
1/13/2024,2024,1,13,9,54947,19983,6867,19443
1/13/2024,2024,1,13,10,52161,18092,6465,18846
1/13/2024,2024,1,13,11,49434,16989,4898,18568
1/13/2024,2024,1,13,12,47098,15583,3865,18470
1/13/2024,2024,1,13,13,45437,13562,3686,18677
1/13/2024,2024,1,13,14,44707,12813,3251,18890
1/13/2024,2024,1,13,15,44399,12727,2760,19099
1/13/2024,2024,1,13,16,45506,13651,2404,19483
1/13/2024,2024,1,13,17,48361,17143,620,19963
1/13/2024,2024,1,13,18,51838,20833,3,20565
1/13/2024,2024,1,13,19,53180,21894,0,20836
1/13/2024,2024,1,13,20,54016,22198,0,21421
1/13/2024,2024,1,13,21,54203,21216,0,22246
1/13/2024,2024,1,13,22,54138,20577,0,22967
1/13/2024,2024,1,13,23,53163,11413,0,23581
1/14/2021,2021,1,14,0,40269,19839,0,15975
1/14/2021,2021,1,14,1,39834,19571,0,16031
1/14/2021,2021,1,14,2,39626,19962,0,15644
1/14/2021,2021,1,14,3,40069,20576,0,15984
1/14/2021,2021,1,14,4,40817,20233,0,17133
1/14/2021,2021,1,14,5,42698,20235,0,18307
1/14/2021,2021,1,14,6,45952,21128,0,20431
1/14/2021,2021,1,14,7,49624,21927,0,20784
1/14/2021,2021,1,14,8,49979,22390,91,19704
1/14/2021,2021,1,14,9,48061,20370,967,19339
1/14/2021,2021,1,14,10,45636,18769,1057,18059
1/14/2021,2021,1,14,11,43562,18859,1173,16576
1/14/2021,2021,1,14,12,41803,19398,1240,15358
1/14/2021,2021,1,14,13,40554,19580,1233,14726
1/14/2021,2021,1,14,14,39575,18682,1432,14355
1/14/2021,2021,1,14,15,38847,17196,1944,14593
1/14/2021,2021,1,14,16,38610,14886,2325,16135
1/14/2021,2021,1,14,17,39012,11346,1762,20276
1/14/2021,2021,1,14,18,41478,8693,92,22196
1/14/2021,2021,1,14,19,42536,9611,0,22186
1/14/2021,2021,1,14,20,42803,10072,0,21981
1/14/2021,2021,1,14,21,42399,10579,0,21388
1/14/2021,2021,1,14,22,41297,11300,0,19981
1/14/2021,2021,1,14,23,39849,11883,0,18678
1/14/2022,2022,1,14,0,36052,10211,0,17154
1/14/2022,2022,1,14,1,35909,12686,0,15800
1/14/2022,2022,1,14,2,36158,13737,0,15254
1/14/2022,2022,1,14,3,36835,13831,0,15435
1/14/2022,2022,1,14,4,38152,14838,0,15776
1/14/2022,2022,1,14,5,40921,16266,0,16756
1/14/2022,2022,1,14,6,44850,17084,0,18541
1/14/2022,2022,1,14,7,47132,18318,47,19236
1/14/2022,2022,1,14,8,46743,18291,2008,18074
1/14/2022,2022,1,14,9,44935,15366,4804,17326
1/14/2022,2022,1,14,10,43269,13892,5810,16780
1/14/2022,2022,1,14,11,42043,15217,5489,15561
1/14/2022,2022,1,14,12,41396,17629,3939,14624
1/14/2022,2022,1,14,13,41098,17791,4281,14323
1/14/2022,2022,1,14,14,40898,16809,5212,14300
1/14/2022,2022,1,14,15,40655,16032,5019,14960
1/14/2022,2022,1,14,16,40743,16513,3849,15499
1/14/2022,2022,1,14,17,41016,17341,915,16502
1/14/2022,2022,1,14,18,42020,20279,2,16016
1/14/2022,2022,1,14,19,41494,22647,0,14324
1/14/2022,2022,1,14,20,40818,23164,0,14230
1/14/2022,2022,1,14,21,39761,23040,0,13811
1/14/2022,2022,1,14,22,38416,23078,0,12950
1/14/2022,2022,1,14,23,36920,8108,0,12268
1/14/2023,2023,1,14,0,42945,20605,0,14081
1/14/2023,2023,1,14,1,42710,20524,0,14125
1/14/2023,2023,1,14,2,42771,20531,0,14108
1/14/2023,2023,1,14,3,43061,20746,0,14206
1/14/2023,2023,1,14,4,43912,20787,0,14777
1/14/2023,2023,1,14,5,45229,21023,0,15140
1/14/2023,2023,1,14,6,47240,21182,0,16015
1/14/2023,2023,1,14,7,49219,21448,158,16916
1/14/2023,2023,1,14,8,49559,20797,2609,16369
1/14/2023,2023,1,14,9,47957,18581,5612,15086
1/14/2023,2023,1,14,10,46012,18660,6064,13793
1/14/2023,2023,1,14,11,43896,19559,5554,12465
1/14/2023,2023,1,14,12,42092,19630,5101,11773
1/14/2023,2023,1,14,13,40719,19694,4745,11253
1/14/2023,2023,1,14,14,39915,20274,4065,10833
1/14/2023,2023,1,14,15,39802,20812,3759,10640
1/14/2023,2023,1,14,16,40136,22104,2915,10423
1/14/2023,2023,1,14,17,41299,23403,780,11534
1/14/2023,2023,1,14,18,43111,24402,2,12437
1/14/2023,2023,1,14,19,43423,24939,0,12394
1/14/2023,2023,1,14,20,43136,24682,0,12491
1/14/2023,2023,1,14,21,42673,25018,0,12112
1/14/2023,2023,1,14,22,41816,25420,0,11628
1/14/2023,2023,1,14,23,43577,20423,0,10921
1/14/2024,2024,1,14,0,53775,19571,0,23610
1/14/2024,2024,1,14,1,53943,18783,0,24124
1/14/2024,2024,1,14,2,54415,16576,0,25895
1/14/2024,2024,1,14,3,55252,13816,0,28410
1/14/2024,2024,1,14,4,56498,11903,0,30275
1/14/2024,2024,1,14,5,57988,10630,0,31358
1/14/2024,2024,1,14,6,59858,9593,0,32661
1/14/2024,2024,1,14,7,61630,9238,104,33847
1/14/2024,2024,1,14,8,63610,9028,1757,34354
1/14/2024,2024,1,14,9,64845,7267,4604,34678
1/14/2024,2024,1,14,10,65101,7090,5808,34361
1/14/2024,2024,1,14,11,65103,6681,7069,33831
1/14/2024,2024,1,14,12,64802,6345,7879,33502
1/14/2024,2024,1,14,13,64854,6444,8068,33243
1/14/2024,2024,1,14,14,64753,7014,7844,33033
1/14/2024,2024,1,14,15,64893,7843,7129,33048
1/14/2024,2024,1,14,16,65670,8997,5344,33606
1/14/2024,2024,1,14,17,67580,10492,1369,35326
1/14/2024,2024,1,14,18,69718,11900,3,36251
1/14/2024,2024,1,14,19,70950,13050,0,36379
1/14/2024,2024,1,14,20,70974,13079,0,36503
1/14/2024,2024,1,14,21,70608,12480,0,36841
1/14/2024,2024,1,14,22,69486,11924,0,36758
1/14/2024,2024,1,14,23,53921,19861,0,37030
1/15/2021,2021,1,15,0,38741,12706,0,17887
1/15/2021,2021,1,15,1,38405,13099,0,17468
1/15/2021,2021,1,15,2,38501,14501,0,16551
1/15/2021,2021,1,15,3,39035,14659,0,17258
1/15/2021,2021,1,15,4,40060,15177,0,17848
1/15/2021,2021,1,15,5,42213,15823,0,19211
1/15/2021,2021,1,15,6,45622,15891,0,21924
1/15/2021,2021,1,15,7,49454,15101,0,23205
1/15/2021,2021,1,15,8,50465,14747,103,22819
1/15/2021,2021,1,15,9,49044,13358,2614,22221
1/15/2021,2021,1,15,10,47755,12828,4075,19789
1/15/2021,2021,1,15,11,46495,16636,4246,17905
1/15/2021,2021,1,15,12,45023,17525,4120,16915
1/15/2021,2021,1,15,13,43648,16659,4115,16162
1/15/2021,2021,1,15,14,42461,16514,4232,14839
1/15/2021,2021,1,15,15,41674,16627,4325,14519
1/15/2021,2021,1,15,16,41455,16370,4164,15514
1/15/2021,2021,1,15,17,41939,14773,2265,19278
1/15/2021,2021,1,15,18,44133,11715,34,22264
1/15/2021,2021,1,15,19,45719,11631,0,22327
1/15/2021,2021,1,15,20,45857,12107,0,22043
1/15/2021,2021,1,15,21,45761,12803,0,21665
1/15/2021,2021,1,15,22,45069,12923,0,21299
1/15/2021,2021,1,15,23,43992,12943,0,20869
1/15/2022,2022,1,15,0,36104,21876,0,11691
1/15/2022,2022,1,15,1,35690,22034,0,11281
1/15/2022,2022,1,15,2,35804,22301,0,11234
1/15/2022,2022,1,15,3,36384,22274,0,11782
1/15/2022,2022,1,15,4,37375,23194,0,11977
1/15/2022,2022,1,15,5,39130,23588,0,12914
1/15/2022,2022,1,15,6,41541,23956,0,13984
1/15/2022,2022,1,15,7,44264,24140,13,15450
1/15/2022,2022,1,15,8,46566,23783,827,16534
1/15/2022,2022,1,15,9,48373,22942,2125,17604
1/15/2022,2022,1,15,10,49150,22911,2482,17791
1/15/2022,2022,1,15,11,49318,22999,2697,18108
1/15/2022,2022,1,15,12,49080,23148,2712,17803
1/15/2022,2022,1,15,13,48770,23061,2806,17624
1/15/2022,2022,1,15,14,48519,22988,2684,17630
1/15/2022,2022,1,15,15,48591,22783,2415,17754
1/15/2022,2022,1,15,16,49275,22741,2167,18159
1/15/2022,2022,1,15,17,51012,22846,730,19626
1/15/2022,2022,1,15,18,52995,20642,1,22552
1/15/2022,2022,1,15,19,53138,18248,0,23797
1/15/2022,2022,1,15,20,52849,17188,0,24147
1/15/2022,2022,1,15,21,52117,15494,0,24442
1/15/2022,2022,1,15,22,50824,13635,0,24438
1/15/2022,2022,1,15,23,37186,22682,0,24428
1/15/2023,2023,1,15,0,39670,25674,0,10282
1/15/2023,2023,1,15,1,39006,25600,0,9704
1/15/2023,2023,1,15,2,38440,25055,0,9580
1/15/2023,2023,1,15,3,38433,25292,0,9468
1/15/2023,2023,1,15,4,38677,25592,0,9678
1/15/2023,2023,1,15,5,39328,25569,0,10126
1/15/2023,2023,1,15,6,40397,25867,0,10819
1/15/2023,2023,1,15,7,41454,25653,83,11478
1/15/2023,2023,1,15,8,42072,25266,1611,11216
1/15/2023,2023,1,15,9,41836,24694,3101,10385
1/15/2023,2023,1,15,10,41043,24649,3047,9796
1/15/2023,2023,1,15,11,40772,24410,3098,9517
1/15/2023,2023,1,15,12,40652,24472,2739,9492
1/15/2023,2023,1,15,13,40206,24285,2606,9426
1/15/2023,2023,1,15,14,40163,24230,2501,9372
1/15/2023,2023,1,15,15,40228,24502,2144,9458
1/15/2023,2023,1,15,16,40569,24710,1350,10073
1/15/2023,2023,1,15,17,41475,25175,227,11064
1/15/2023,2023,1,15,18,42665,25685,0,11264
1/15/2023,2023,1,15,19,42510,26036,0,11222
1/15/2023,2023,1,15,20,41879,26106,0,10962
1/15/2023,2023,1,15,21,40811,25647,0,10652
1/15/2023,2023,1,15,22,39418,24720,0,10469
1/15/2023,2023,1,15,23,40742,25650,0,9786
1/15/2024,2024,1,15,0,67486,8412,0,37048
1/15/2024,2024,1,15,1,66967,7185,0,36953
1/15/2024,2024,1,15,2,66970,6681,0,37098
1/15/2024,2024,1,15,3,67320,6001,0,37251
1/15/2024,2024,1,15,4,68270,5067,0,37987
1/15/2024,2024,1,15,5,69761,4468,0,39027
1/15/2024,2024,1,15,6,71592,4704,0,39819
1/15/2024,2024,1,15,7,73318,4960,11,40299
1/15/2024,2024,1,15,8,74451,5260,1739,39859
1/15/2024,2024,1,15,9,75590,4874,6153,39030
1/15/2024,2024,1,15,10,75982,4238,7652,38483
1/15/2024,2024,1,15,11,75533,3763,8283,37988
1/15/2024,2024,1,15,12,74157,3536,8333,37233
1/15/2024,2024,1,15,13,73006,4458,8539,35737
1/15/2024,2024,1,15,14,71949,7199,8640,33672
1/15/2024,2024,1,15,15,70944,10720,7596,32432
1/15/2024,2024,1,15,16,71194,14486,5201,31768
1/15/2024,2024,1,15,17,73628,20034,1294,31993
1/15/2024,2024,1,15,18,76019,21533,17,33046
1/15/2024,2024,1,15,19,76312,21287,13,33514
1/15/2024,2024,1,15,20,76339,21654,12,33181
1/15/2024,2024,1,15,21,75774,23072,0,32548
1/15/2024,2024,1,15,22,74243,24059,0,31587
1/15/2024,2024,1,15,23,68357,10496,0,31583
1/16/2021,2021,1,16,0,43018,12192,0,21101
1/16/2021,2021,1,16,1,42105,10275,0,21480
1/16/2021,2021,1,16,2,41990,9288,0,21737
1/16/2021,2021,1,16,3,42148,8878,0,22512
1/16/2021,2021,1,16,4,42753,7801,0,23159
1/16/2021,2021,1,16,5,43860,7231,0,23857
1/16/2021,2021,1,16,6,45797,6984,0,24751
1/16/2021,2021,1,16,7,47854,6372,0,26104
1/16/2021,2021,1,16,8,49011,5408,94,26029
1/16/2021,2021,1,16,9,48341,4800,2874,25343
1/16/2021,2021,1,16,10,46425,3070,4120,24724
1/16/2021,2021,1,16,11,43819,2564,4173,23604
1/16/2021,2021,1,16,12,41587,3119,3870,22344
1/16/2021,2021,1,16,13,39704,3964,3829,20932
1/16/2021,2021,1,16,14,38056,4265,3728,20196
1/16/2021,2021,1,16,15,36937,3941,2958,20320
1/16/2021,2021,1,16,16,36530,3529,1452,21558
1/16/2021,2021,1,16,17,37586,3668,651,22108
1/16/2021,2021,1,16,18,39893,5180,10,22492
1/16/2021,2021,1,16,19,41349,7195,0,22450
1/16/2021,2021,1,16,20,41500,7735,0,22373
1/16/2021,2021,1,16,21,41568,7419,0,22387
1/16/2021,2021,1,16,22,41084,6494,0,22279
1/16/2021,2021,1,16,23,40432,5926,0,21728
1/16/2022,2022,1,16,0,48537,10682,0,24608
1/16/2022,2022,1,16,1,48042,9895,0,24950
1/16/2022,2022,1,16,2,47890,9333,0,25075
1/16/2022,2022,1,16,3,48205,9426,0,24881
1/16/2022,2022,1,16,4,48826,9631,0,24874
1/16/2022,2022,1,16,5,49903,9884,0,25364
1/16/2022,2022,1,16,6,51312,9330,0,25882
1/16/2022,2022,1,16,7,52833,10009,60,26484
1/16/2022,2022,1,16,8,53004,10045,2653,25528
1/16/2022,2022,1,16,9,51569,7950,6843,23861
1/16/2022,2022,1,16,10,49105,5442,7290,23262
1/16/2022,2022,1,16,11,46524,4269,7018,22563
1/16/2022,2022,1,16,12,44057,4221,6782,21356
1/16/2022,2022,1,16,13,42010,4970,6782,20171
1/16/2022,2022,1,16,14,40523,4793,7048,19100
1/16/2022,2022,1,16,15,39698,3894,7180,19358
1/16/2022,2022,1,16,16,39519,3052,5952,20323
1/16/2022,2022,1,16,17,41002,1865,1541,23585
1/16/2022,2022,1,16,18,43510,1956,2,25806
1/16/2022,2022,1,16,19,44779,2661,0,26683
1/16/2022,2022,1,16,20,45102,3331,0,26223
1/16/2022,2022,1,16,21,45052,4212,0,25538
1/16/2022,2022,1,16,22,44281,5253,0,24316
1/16/2022,2022,1,16,23,49564,11908,0,23271
1/16/2023,2023,1,16,0,36105,22773,0,9416
1/16/2023,2023,1,16,1,35114,21393,0,9604
1/16/2023,2023,1,16,2,34312,19866,0,10050
1/16/2023,2023,1,16,3,34064,18090,0,10946
1/16/2023,2023,1,16,4,34557,16843,0,11980
1/16/2023,2023,1,16,5,35832,16978,0,12503
1/16/2023,2023,1,16,6,37611,16839,0,13419
1/16/2023,2023,1,16,7,39008,15927,27,14610
1/16/2023,2023,1,16,8,39855,14806,1190,15028
1/16/2023,2023,1,16,9,40626,12828,3260,15462
1/16/2023,2023,1,16,10,41852,12275,4821,15982
1/16/2023,2023,1,16,11,42689,13987,5719,15368
1/16/2023,2023,1,16,12,43084,16151,5789,14144
1/16/2023,2023,1,16,13,43542,16542,5376,14347
1/16/2023,2023,1,16,14,44015,17505,4925,14326
1/16/2023,2023,1,16,15,44212,16994,4906,14721
1/16/2023,2023,1,16,16,44434,16183,3429,15690
1/16/2023,2023,1,16,17,44746,14357,649,17833
1/16/2023,2023,1,16,18,45752,13792,2,19191
1/16/2023,2023,1,16,19,45056,14383,0,18778
1/16/2023,2023,1,16,20,43749,15458,0,17606
1/16/2023,2023,1,16,21,42232,15821,0,16573
1/16/2023,2023,1,16,22,39887,15597,0,15659
1/16/2023,2023,1,16,23,37660,23955,0,14433
1/16/2024,2024,1,16,0,72179,19978,0,32614
1/16/2024,2024,1,16,1,72076,17247,0,33717
1/16/2024,2024,1,16,2,72354,15136,0,34917
1/16/2024,2024,1,16,3,72512,13364,0,35835
1/16/2024,2024,1,16,4,73391,11862,0,36902
1/16/2024,2024,1,16,5,75124,10929,0,37896
1/16/2024,2024,1,16,6,77222,10027,0,38742
1/16/2024,2024,1,16,7,78154,9359,182,39351
1/16/2024,2024,1,16,8,77878,8355,5391,37995
1/16/2024,2024,1,16,9,76479,8604,12632,35028
1/16/2024,2024,1,16,10,74404,7149,14083,33853
1/16/2024,2024,1,16,11,72236,5862,13971,33217
1/16/2024,2024,1,16,12,70243,4854,13827,32901
1/16/2024,2024,1,16,13,67781,3889,13959,31874
1/16/2024,2024,1,16,14,65606,3233,14444,30351
1/16/2024,2024,1,16,15,63992,2900,14637,28615
1/16/2024,2024,1,16,16,64102,2492,11019,30744
1/16/2024,2024,1,16,17,66465,2014,2355,35239
1/16/2024,2024,1,16,18,69662,2149,2,37393
1/16/2024,2024,1,16,19,71074,3232,0,37615
1/16/2024,2024,1,16,20,71886,5093,0,37124
1/16/2024,2024,1,16,21,71446,7311,0,36125
1/16/2024,2024,1,16,22,69849,9485,0,34702
1/16/2024,2024,1,16,23,72978,23082,0,33387
1/17/2021,2021,1,17,0,39730,6130,0,20944
1/17/2021,2021,1,17,1,39056,6603,0,20937
1/17/2021,2021,1,17,2,38845,6370,0,20884
1/17/2021,2021,1,17,3,38889,7077,0,20939
1/17/2021,2021,1,17,4,39346,6626,0,21611
1/17/2021,2021,1,17,5,40129,5983,0,21960
1/17/2021,2021,1,17,6,41284,6347,0,22646
1/17/2021,2021,1,17,7,42848,6966,0,23443
1/17/2021,2021,1,17,8,44191,6819,75,23669
1/17/2021,2021,1,17,9,43638,5005,2384,23336
1/17/2021,2021,1,17,10,41994,2612,3609,22709
1/17/2021,2021,1,17,11,40243,3079,3724,21402
1/17/2021,2021,1,17,12,38844,2884,3736,21080
1/17/2021,2021,1,17,13,37581,2095,3812,20550
1/17/2021,2021,1,17,14,36405,1304,3987,20121
1/17/2021,2021,1,17,15,35888,989,4264,20004
1/17/2021,2021,1,17,16,35624,1053,4061,20903
1/17/2021,2021,1,17,17,36212,1317,2092,23069
1/17/2021,2021,1,17,18,38656,1766,65,24223
1/17/2021,2021,1,17,19,40096,3188,0,23978
1/17/2021,2021,1,17,20,40262,5527,0,23256
1/17/2021,2021,1,17,21,40157,8071,0,21947
1/17/2021,2021,1,17,22,39624,10532,0,19849
1/17/2021,2021,1,17,23,38708,13008,0,17097
1/17/2022,2022,1,17,0,43176,5365,0,23433
1/17/2022,2022,1,17,1,43188,5528,0,23550
1/17/2022,2022,1,17,2,43636,5563,0,23807
1/17/2022,2022,1,17,3,44573,5816,0,23867
1/17/2022,2022,1,17,4,46000,5684,0,24491
1/17/2022,2022,1,17,5,48518,5380,0,25928
1/17/2022,2022,1,17,6,51495,5074,0,27214
1/17/2022,2022,1,17,7,53589,5005,70,28342
1/17/2022,2022,1,17,8,52883,5294,2632,27140
1/17/2022,2022,1,17,9,50200,4010,6568,24783
1/17/2022,2022,1,17,10,47356,4655,6982,22687
1/17/2022,2022,1,17,11,45002,6010,6703,20576
1/17/2022,2022,1,17,12,43109,6524,6469,19275
1/17/2022,2022,1,17,13,41634,7961,6388,18013
1/17/2022,2022,1,17,14,40732,9660,6404,16724
1/17/2022,2022,1,17,15,40338,11472,5548,15887
1/17/2022,2022,1,17,16,40476,12737,3907,15867
1/17/2022,2022,1,17,17,41423,13090,1306,17835
1/17/2022,2022,1,17,18,43729,16368,11,18438
1/17/2022,2022,1,17,19,44224,18709,0,17674
1/17/2022,2022,1,17,20,43959,19313,0,17249
1/17/2022,2022,1,17,21,43096,19901,0,16385
1/17/2022,2022,1,17,22,41488,20046,0,15540
1/17/2022,2022,1,17,23,43496,5882,0,14472
1/17/2023,2023,1,17,0,36140,16936,0,13140
1/17/2023,2023,1,17,1,35213,16170,0,12799
1/17/2023,2023,1,17,2,34646,14405,0,13264
1/17/2023,2023,1,17,3,34600,13189,0,14038
1/17/2023,2023,1,17,4,35408,11972,0,15492
1/17/2023,2023,1,17,5,37326,10503,0,17328
1/17/2023,2023,1,17,6,40790,8856,0,19815
1/17/2023,2023,1,17,7,42389,7592,56,21227
1/17/2023,2023,1,17,8,42255,5897,1551,21086
1/17/2023,2023,1,17,9,41984,3917,4186,20805
1/17/2023,2023,1,17,10,41881,2468,5378,21065
1/17/2023,2023,1,17,11,42095,2544,5956,20960
1/17/2023,2023,1,17,12,42562,3877,6344,20130
1/17/2023,2023,1,17,13,42951,5731,6471,19258
1/17/2023,2023,1,17,14,43690,6893,5591,19327
1/17/2023,2023,1,17,15,44195,9265,4837,18426
1/17/2023,2023,1,17,16,44340,10303,3001,18778
1/17/2023,2023,1,17,17,44655,9817,592,20381
1/17/2023,2023,1,17,18,45702,10301,1,20837
1/17/2023,2023,1,17,19,45129,11195,0,20123
1/17/2023,2023,1,17,20,44385,13032,0,18883
1/17/2023,2023,1,17,21,43054,13877,0,17863
1/17/2023,2023,1,17,22,40805,15962,0,15840
1/17/2023,2023,1,17,23,37915,16545,0,14474
1/17/2024,2024,1,17,0,69238,15095,0,31975
1/17/2024,2024,1,17,1,69049,17312,0,30590
1/17/2024,2024,1,17,2,69121,18536,0,29927
1/17/2024,2024,1,17,3,69531,19114,0,29755
1/17/2024,2024,1,17,4,70747,19421,0,30582
1/17/2024,2024,1,17,5,73084,19563,0,31922
1/17/2024,2024,1,17,6,76150,18744,0,33511
1/17/2024,2024,1,17,7,77370,18559,178,33812
1/17/2024,2024,1,17,8,75419,18447,3293,31499
1/17/2024,2024,1,17,9,72155,18568,7497,27587
1/17/2024,2024,1,17,10,68358,18436,9225,25113
1/17/2024,2024,1,17,11,64658,18065,9760,22968
1/17/2024,2024,1,17,12,61418,18923,9072,21130
1/17/2024,2024,1,17,13,58438,19356,8571,19431
1/17/2024,2024,1,17,14,56533,19919,7756,18571
1/17/2024,2024,1,17,15,55734,20398,6714,18454
1/17/2024,2024,1,17,16,56440,20702,4390,20067
1/17/2024,2024,1,17,17,58962,21270,865,23127
1/17/2024,2024,1,17,18,62174,21914,4,25429
1/17/2024,2024,1,17,19,62912,22101,0,25736
1/17/2024,2024,1,17,20,62944,22245,0,25874
1/17/2024,2024,1,17,21,61527,22168,0,24903
1/17/2024,2024,1,17,22,58947,22247,0,23640
1/17/2024,2024,1,17,23,69386,12134,0,22393
1/18/2021,2021,1,18,0,38087,16253,0,15148
1/18/2021,2021,1,18,1,37912,18435,0,13820
1/18/2021,2021,1,18,2,38035,19666,0,13366
1/18/2021,2021,1,18,3,38543,19954,0,13610
1/18/2021,2021,1,18,4,39478,20428,0,14524
1/18/2021,2021,1,18,5,41068,20539,0,16470
1/18/2021,2021,1,18,6,43624,20073,0,18469
1/18/2021,2021,1,18,7,45877,19095,0,19635
1/18/2021,2021,1,18,8,46849,19856,115,18944
1/18/2021,2021,1,18,9,45982,18857,1823,18490
1/18/2021,2021,1,18,10,44723,16286,3643,16649
1/18/2021,2021,1,18,11,43385,16884,3876,15984
1/18/2021,2021,1,18,12,42000,16449,3726,15880
1/18/2021,2021,1,18,13,40545,15107,3805,16033
1/18/2021,2021,1,18,14,39151,13657,3892,16032
1/18/2021,2021,1,18,15,38458,13014,4009,15946
1/18/2021,2021,1,18,16,38377,12904,3981,16330
1/18/2021,2021,1,18,17,38716,13851,2293,17267
1/18/2021,2021,1,18,18,40203,16538,48,16911
1/18/2021,2021,1,18,19,41180,19539,0,15386
1/18/2021,2021,1,18,20,40619,20688,0,14838
1/18/2021,2021,1,18,21,39556,20573,0,13632
1/18/2021,2021,1,18,22,37666,20630,0,12059
1/18/2021,2021,1,18,23,35580,19878,0,11345
1/18/2022,2022,1,18,0,38864,20254,0,13748
1/18/2022,2022,1,18,1,38449,20199,0,13576
1/18/2022,2022,1,18,2,38516,20267,0,13504
1/18/2022,2022,1,18,3,39012,20244,0,14232
1/18/2022,2022,1,18,4,40138,20397,0,14812
1/18/2022,2022,1,18,5,42669,20955,0,16113
1/18/2022,2022,1,18,6,46456,22261,0,17460
1/18/2022,2022,1,18,7,47967,22329,38,18408
1/18/2022,2022,1,18,8,46882,20533,1964,17735
1/18/2022,2022,1,18,9,45128,16858,4677,17322
1/18/2022,2022,1,18,10,43489,17563,5608,15058
1/18/2022,2022,1,18,11,42264,18843,5079,13868
1/18/2022,2022,1,18,12,41280,20016,3633,13558
1/18/2022,2022,1,18,13,40806,19911,3414,13284
1/18/2022,2022,1,18,14,40603,19845,3378,13171
1/18/2022,2022,1,18,15,40626,19678,3490,13334
1/18/2022,2022,1,18,16,40851,19262,3165,13829
1/18/2022,2022,1,18,17,41319,17400,965,16195
1/18/2022,2022,1,18,18,42736,15180,5,19407
1/18/2022,2022,1,18,19,42452,16111,0,18692
1/18/2022,2022,1,18,20,41629,17867,0,17261
1/18/2022,2022,1,18,21,40162,18968,0,16382
1/18/2022,2022,1,18,22,38098,18360,0,15566
1/18/2022,2022,1,18,23,39815,20192,0,14014
1/18/2023,2023,1,18,0,36778,16537,0,13666
1/18/2023,2023,1,18,1,35957,17834,0,12515
1/18/2023,2023,1,18,2,35469,20315,0,11124
1/18/2023,2023,1,18,3,35384,20724,0,10862
1/18/2023,2023,1,18,4,35980,20737,0,11319
1/18/2023,2023,1,18,5,37500,20119,0,12445
1/18/2023,2023,1,18,6,40390,20756,0,13381
1/18/2023,2023,1,18,7,41971,20524,27,14460
1/18/2023,2023,1,18,8,42333,20022,1682,14183
1/18/2023,2023,1,18,9,42872,19358,3705,14013
1/18/2023,2023,1,18,10,43132,20017,3824,13903
1/18/2023,2023,1,18,11,43402,20053,4003,13942
1/18/2023,2023,1,18,12,43581,19976,4206,14014
1/18/2023,2023,1,18,13,44055,20802,4259,13736
1/18/2023,2023,1,18,14,43725,21392,4100,13204
1/18/2023,2023,1,18,15,43627,21109,4182,13121
1/18/2023,2023,1,18,16,43625,20766,3503,13600
1/18/2023,2023,1,18,17,43899,20907,910,14798
1/18/2023,2023,1,18,18,44643,20231,8,16093
1/18/2023,2023,1,18,19,44246,20438,0,15717
1/18/2023,2023,1,18,20,43478,21363,0,15006
1/18/2023,2023,1,18,21,42180,21356,0,14276
1/18/2023,2023,1,18,22,40066,20778,0,13497
1/18/2023,2023,1,18,23,38451,16385,0,12552
1/18/2024,2024,1,18,0,54852,21908,0,21424
1/18/2024,2024,1,18,1,53963,22028,0,20905
1/18/2024,2024,1,18,2,53404,21902,0,20952
1/18/2024,2024,1,18,3,53375,21218,0,21388
1/18/2024,2024,1,18,4,54219,19516,0,22715
1/18/2024,2024,1,18,5,56332,18042,0,24756
1/18/2024,2024,1,18,6,59291,17227,1,26601
1/18/2024,2024,1,18,7,60103,15716,108,27830
1/18/2024,2024,1,18,8,58208,13955,4184,25694
1/18/2024,2024,1,18,9,55240,9818,10694,22460
1/18/2024,2024,1,18,10,51870,6248,11937,21448
1/18/2024,2024,1,18,11,49099,4876,11869,20520
1/18/2024,2024,1,18,12,46834,5884,11781,19146
1/18/2024,2024,1,18,13,45405,7132,11855,18089
1/18/2024,2024,1,18,14,44543,7706,11498,17133
1/18/2024,2024,1,18,15,44066,7816,10679,16880
1/18/2024,2024,1,18,16,44333,6682,9126,17866
1/18/2024,2024,1,18,17,45774,5200,2257,22551
1/18/2024,2024,1,18,18,48566,6250,7,25713
1/18/2024,2024,1,18,19,49168,7537,0,25139
1/18/2024,2024,1,18,20,49367,9023,0,24180
1/18/2024,2024,1,18,21,48735,11454,0,22418
1/18/2024,2024,1,18,22,47612,14636,0,19917
1/18/2024,2024,1,18,23,56754,22076,0,17545
1/19/2021,2021,1,19,0,33681,19411,0,10902
1/19/2021,2021,1,19,1,32406,18774,0,10599
1/19/2021,2021,1,19,2,31923,18411,0,10536
1/19/2021,2021,1,19,3,31632,17883,0,10618
1/19/2021,2021,1,19,4,31770,17882,0,10979
1/19/2021,2021,1,19,5,32922,17776,0,11736
1/19/2021,2021,1,19,6,35718,18976,0,14052
1/19/2021,2021,1,19,7,38848,18408,0,16097
1/19/2021,2021,1,19,8,39797,17880,20,17124
1/19/2021,2021,1,19,9,40181,17533,543,16676
1/19/2021,2021,1,19,10,41122,19092,902,15961
1/19/2021,2021,1,19,11,41577,19741,833,15666
1/19/2021,2021,1,19,12,41704,20147,1048,15486
1/19/2021,2021,1,19,13,41722,20340,1262,15607
1/19/2021,2021,1,19,14,41188,19362,1013,16348
1/19/2021,2021,1,19,15,41577,19500,838,16623
1/19/2021,2021,1,19,16,41777,18915,621,17682
1/19/2021,2021,1,19,17,42168,16991,223,19213
1/19/2021,2021,1,19,18,43786,14924,1,21414
1/19/2021,2021,1,19,19,43781,12525,0,22389
1/19/2021,2021,1,19,20,42807,10882,0,22663
1/19/2021,2021,1,19,21,41527,9005,0,22766
1/19/2021,2021,1,19,22,39770,7267,0,22263
1/19/2021,2021,1,19,23,37554,6205,0,21844
1/19/2022,2022,1,19,0,34450,17260,0,13387
1/19/2022,2022,1,19,1,33485,16657,0,12881
1/19/2022,2022,1,19,2,33144,16044,0,13198
1/19/2022,2022,1,19,3,33304,17055,0,12454
1/19/2022,2022,1,19,4,33880,17027,0,12769
1/19/2022,2022,1,19,5,35742,16483,0,14462
1/19/2022,2022,1,19,6,38921,17315,0,15766
1/19/2022,2022,1,19,7,40552,18490,27,16074
1/19/2022,2022,1,19,8,40854,17854,1878,15303
1/19/2022,2022,1,19,9,41403,16304,5428,14542
1/19/2022,2022,1,19,10,41828,17831,4432,14667
1/19/2022,2022,1,19,11,41940,18907,3285,14788
1/19/2022,2022,1,19,12,42184,18189,3039,15441
1/19/2022,2022,1,19,13,42605,18617,2858,15650
1/19/2022,2022,1,19,14,42874,18894,2628,16005
1/19/2022,2022,1,19,15,43097,20229,1820,16062
1/19/2022,2022,1,19,16,43558,21170,927,16266
1/19/2022,2022,1,19,17,44907,21411,404,16986
1/19/2022,2022,1,19,18,46581,22408,2,17723
1/19/2022,2022,1,19,19,46834,22519,0,17865
1/19/2022,2022,1,19,20,46620,21865,0,18215
1/19/2022,2022,1,19,21,45883,21013,0,18382
1/19/2022,2022,1,19,22,44163,20394,0,18025
1/19/2022,2022,1,19,23,35952,18401,0,17198
1/19/2023,2023,1,19,0,36532,19960,0,11941
1/19/2023,2023,1,19,1,35659,19790,0,11509
1/19/2023,2023,1,19,2,35394,19711,0,11493
1/19/2023,2023,1,19,3,35439,19222,0,11990
1/19/2023,2023,1,19,4,36319,17795,0,13322
1/19/2023,2023,1,19,5,38690,16597,0,14779
1/19/2023,2023,1,19,6,43037,15873,0,16721
1/19/2023,2023,1,19,7,45029,14604,140,18135
1/19/2023,2023,1,19,8,44657,10858,3596,18175
1/19/2023,2023,1,19,9,43866,6307,8079,17757
1/19/2023,2023,1,19,10,42790,6604,8691,16850
1/19/2023,2023,1,19,11,41939,5007,8532,17330
1/19/2023,2023,1,19,12,41320,3482,8219,18172
1/19/2023,2023,1,19,13,40980,2701,8316,18610
1/19/2023,2023,1,19,14,40780,2312,8469,18604
1/19/2023,2023,1,19,15,40688,2267,8057,18849
1/19/2023,2023,1,19,16,41093,1979,5701,20090
1/19/2023,2023,1,19,17,42021,1905,1244,23070
1/19/2023,2023,1,19,18,43515,2634,5,24285
1/19/2023,2023,1,19,19,43729,4376,0,23455
1/19/2023,2023,1,19,20,43576,6277,0,22438
1/19/2023,2023,1,19,21,42595,8239,0,20802
1/19/2023,2023,1,19,22,40766,10312,0,18622
1/19/2023,2023,1,19,23,38001,20561,0,17156
1/19/2024,2024,1,19,0,45522,19613,0,16791
1/19/2024,2024,1,19,1,45466,20044,0,16736
1/19/2024,2024,1,19,2,46185,21089,0,16569
1/19/2024,2024,1,19,3,47651,21912,0,16819
1/19/2024,2024,1,19,4,49955,22561,0,17482
1/19/2024,2024,1,19,5,53255,23571,0,18476
1/19/2024,2024,1,19,6,58042,24089,0,21276
1/19/2024,2024,1,19,7,60870,24082,218,23776
1/19/2024,2024,1,19,8,61130,22535,5626,21914
1/19/2024,2024,1,19,9,60293,22469,11981,18497
1/19/2024,2024,1,19,10,59145,20422,13714,18148
1/19/2024,2024,1,19,11,57353,18119,13675,18399
1/19/2024,2024,1,19,12,55572,15785,13706,18850
1/19/2024,2024,1,19,13,54385,14299,13777,18901
1/19/2024,2024,1,19,14,53366,13200,14106,18980
1/19/2024,2024,1,19,15,53129,11884,14217,19601
1/19/2024,2024,1,19,16,54088,10889,10964,21788
1/19/2024,2024,1,19,17,56895,10357,2581,27674
1/19/2024,2024,1,19,18,60861,9978,8,32176
1/19/2024,2024,1,19,19,61999,10702,0,32669
1/19/2024,2024,1,19,20,62779,11292,0,32673
1/19/2024,2024,1,19,21,62802,10529,0,32766
1/19/2024,2024,1,19,22,62147,10309,0,32333
1/19/2024,2024,1,19,23,46376,18376,0,32108
1/2/2021,2021,1,2,0,42138,4434,0,24162
1/2/2021,2021,1,2,1,41238,3538,0,24240
1/2/2021,2021,1,2,2,40585,2811,0,24025
1/2/2021,2021,1,2,3,40341,2795,0,23852
1/2/2021,2021,1,2,4,40596,3458,0,24455
1/2/2021,2021,1,2,5,41415,3116,0,25623
1/2/2021,2021,1,2,6,42852,2909,0,26583
1/2/2021,2021,1,2,7,44536,3432,0,27224
1/2/2021,2021,1,2,8,45677,3936,70,26801
1/2/2021,2021,1,2,9,45616,4611,2203,25171
1/2/2021,2021,1,2,10,44343,3758,3398,23718
1/2/2021,2021,1,2,11,42613,5306,3526,21180
1/2/2021,2021,1,2,12,40836,7118,3432,18845
1/2/2021,2021,1,2,13,39340,8697,3421,17687
1/2/2021,2021,1,2,14,37825,9414,3572,16779
1/2/2021,2021,1,2,15,36918,9845,3584,16245
1/2/2021,2021,1,2,16,36622,9791,3519,16914
1/2/2021,2021,1,2,17,37408,9484,1522,18517
1/2/2021,2021,1,2,18,40836,12059,2,18750
1/2/2021,2021,1,2,19,42399,14528,0,17907
1/2/2021,2021,1,2,20,42891,15884,0,17662
1/2/2021,2021,1,2,21,43281,16532,0,17543
1/2/2021,2021,1,2,22,42734,16249,0,17170
1/2/2021,2021,1,2,23,41991,15913,0,16449
1/2/2022,2022,1,2,0,42880,20688,0,15609
1/2/2022,2022,1,2,1,42167,19945,0,15678
1/2/2022,2022,1,2,2,42061,19966,0,15877
1/2/2022,2022,1,2,3,42512,20256,0,16216
1/2/2022,2022,1,2,4,43465,20746,0,16680
1/2/2022,2022,1,2,5,44869,20298,0,17655
1/2/2022,2022,1,2,6,46848,19938,0,18462
1/2/2022,2022,1,2,7,49302,19361,16,20281
1/2/2022,2022,1,2,8,51361,17962,1862,21119
1/2/2022,2022,1,2,9,52452,15776,5494,20806
1/2/2022,2022,1,2,10,52303,12999,6236,21983
1/2/2022,2022,1,2,11,51421,10892,6051,22902
1/2/2022,2022,1,2,12,50253,10503,6221,22083
1/2/2022,2022,1,2,13,48523,9621,6476,21374
1/2/2022,2022,1,2,14,47014,8678,6795,20878
1/2/2022,2022,1,2,15,46134,7611,6831,21133
1/2/2022,2022,1,2,16,46227,6175,5168,22700
1/2/2022,2022,1,2,17,48727,5080,955,26913
1/2/2022,2022,1,2,18,51674,4874,0,28945
1/2/2022,2022,1,2,19,52376,4815,0,28998
1/2/2022,2022,1,2,20,52325,4928,0,28674
1/2/2022,2022,1,2,21,52011,4975,0,28307
1/2/2022,2022,1,2,22,50708,4908,0,27558
1/2/2022,2022,1,2,23,43861,21549,0,27060
1/2/2023,2023,1,2,0,36027,22604,0,11460
1/2/2023,2023,1,2,1,35035,21872,0,11241
1/2/2023,2023,1,2,2,34350,21431,0,11190
1/2/2023,2023,1,2,3,34014,20827,0,11184
1/2/2023,2023,1,2,4,34221,20714,0,11389
1/2/2023,2023,1,2,5,34954,20829,0,11618
1/2/2023,2023,1,2,6,36168,21969,0,11480
1/2/2023,2023,1,2,7,37252,21988,10,11863
1/2/2023,2023,1,2,8,38185,19706,664,13215
1/2/2023,2023,1,2,9,40013,17478,3222,13933
1/2/2023,2023,1,2,10,41299,16429,4734,14385
1/2/2023,2023,1,2,11,42604,17078,5255,14359
1/2/2023,2023,1,2,12,43380,19274,5274,13807
1/2/2023,2023,1,2,13,43914,19428,5348,13861
1/2/2023,2023,1,2,14,44219,19861,4883,13950
1/2/2023,2023,1,2,15,44682,20618,3996,14404
1/2/2023,2023,1,2,16,44971,21884,2643,14609
1/2/2023,2023,1,2,17,45929,23255,533,15526
1/2/2023,2023,1,2,18,46499,21955,0,17075
1/2/2023,2023,1,2,19,45772,20821,1,16898
1/2/2023,2023,1,2,20,44636,20367,1,16226
1/2/2023,2023,1,2,21,43393,20157,1,15689
1/2/2023,2023,1,2,22,41402,20956,1,14220
1/2/2023,2023,1,2,23,37531,23565,0,12448
1/2/2024,2024,1,2,0,46073,9179,0,22426
1/2/2024,2024,1,2,1,45518,9055,0,21912
1/2/2024,2024,1,2,2,45461,9291,0,21651
1/2/2024,2024,1,2,3,45588,10146,0,20879
1/2/2024,2024,1,2,4,46611,10511,0,20996
1/2/2024,2024,1,2,5,48927,10213,0,22761
1/2/2024,2024,1,2,6,51693,8015,0,25646
1/2/2024,2024,1,2,7,53466,5995,143,27243
1/2/2024,2024,1,2,8,53859,4688,2138,27162
1/2/2024,2024,1,2,9,54172,3370,4237,27476
1/2/2024,2024,1,2,10,53386,3076,5030,27268
1/2/2024,2024,1,2,11,52414,3358,5945,26305
1/2/2024,2024,1,2,12,51477,3617,6170,25487
1/2/2024,2024,1,2,13,51618,3829,5684,25967
1/2/2024,2024,1,2,14,51735,4045,4709,26330
1/2/2024,2024,1,2,15,51869,4997,3296,26456
1/2/2024,2024,1,2,16,52338,5187,2184,27102
1/2/2024,2024,1,2,17,53682,4909,433,28596
1/2/2024,2024,1,2,18,54163,3609,0,29175
1/2/2024,2024,1,2,19,53834,2921,0,29296
1/2/2024,2024,1,2,20,52459,3050,0,29067
1/2/2024,2024,1,2,21,51056,3197,0,28502
1/2/2024,2024,1,2,22,49000,3521,0,27566
1/2/2024,2024,1,2,23,46767,9081,0,26359
1/20/2021,2021,1,20,0,35588,4564,0,21336
1/20/2021,2021,1,20,1,34848,3466,0,20921
1/20/2021,2021,1,20,2,34106,3241,0,20349
1/20/2021,2021,1,20,3,34114,3236,0,20644
1/20/2021,2021,1,20,4,34513,2796,0,21331
1/20/2021,2021,1,20,5,35943,3232,0,22131
1/20/2021,2021,1,20,6,38520,3475,0,23442
1/20/2021,2021,1,20,7,41795,3658,0,24309
1/20/2021,2021,1,20,8,42842,4149,11,24480
1/20/2021,2021,1,20,9,43459,3740,281,24322
1/20/2021,2021,1,20,10,43717,4254,438,24021
1/20/2021,2021,1,20,11,43643,5034,856,23457
1/20/2021,2021,1,20,12,43924,5623,1509,23247
1/20/2021,2021,1,20,13,43260,5796,1445,22690
1/20/2021,2021,1,20,14,42897,5961,1757,22654
1/20/2021,2021,1,20,15,42485,5927,1100,23037
1/20/2021,2021,1,20,16,42826,5448,678,23370
1/20/2021,2021,1,20,17,43515,5249,428,23691
1/20/2021,2021,1,20,18,45313,6099,24,23133
1/20/2021,2021,1,20,19,45149,8606,1,22069
1/20/2021,2021,1,20,20,44376,11358,1,21039
1/20/2021,2021,1,20,21,43154,12311,1,20130
1/20/2021,2021,1,20,22,41225,12580,1,19123
1/20/2021,2021,1,20,23,38954,13040,1,17653
1/20/2022,2022,1,20,0,42139,21051,0,16277
1/20/2022,2022,1,20,1,42144,21023,0,16195
1/20/2022,2022,1,20,2,42686,21381,0,16105
1/20/2022,2022,1,20,3,43933,21909,0,16549
1/20/2022,2022,1,20,4,45700,22407,0,17146
1/20/2022,2022,1,20,5,48866,22543,0,19272
1/20/2022,2022,1,20,6,53475,22204,0,22091
1/20/2022,2022,1,20,7,56603,21954,7,24303
1/20/2022,2022,1,20,8,57985,21190,328,25287
1/20/2022,2022,1,20,9,59110,19927,1105,26080
1/20/2022,2022,1,20,10,59550,19014,1741,26572
1/20/2022,2022,1,20,11,59369,18328,2500,26696
1/20/2022,2022,1,20,12,58524,17558,2894,26376
1/20/2022,2022,1,20,13,57709,16377,3261,25932
1/20/2022,2022,1,20,14,56854,15251,3371,26075
1/20/2022,2022,1,20,15,56909,14793,2644,26248
1/20/2022,2022,1,20,16,58107,13635,1646,27958
1/20/2022,2022,1,20,17,60081,11613,485,30075
1/20/2022,2022,1,20,18,62023,9777,4,31969
1/20/2022,2022,1,20,19,61885,9370,0,32278
1/20/2022,2022,1,20,20,61184,8435,0,32434
1/20/2022,2022,1,20,21,59641,7418,0,31879
1/20/2022,2022,1,20,22,57267,6884,0,30670
1/20/2022,2022,1,20,23,42751,20475,0,29289
1/20/2023,2023,1,20,0,37843,13237,0,16059
1/20/2023,2023,1,20,1,37301,13717,0,15657
1/20/2023,2023,1,20,2,37213,13742,0,15978
1/20/2023,2023,1,20,3,37532,14321,0,16215
1/20/2023,2023,1,20,4,38394,14751,0,16791
1/20/2023,2023,1,20,5,40701,14780,0,18074
1/20/2023,2023,1,20,6,44319,15099,0,19667
1/20/2023,2023,1,20,7,46089,16373,46,20142
1/20/2023,2023,1,20,8,46119,17924,2009,18482
1/20/2023,2023,1,20,9,45848,16327,5266,17868
1/20/2023,2023,1,20,10,45522,17655,5881,16889
1/20/2023,2023,1,20,11,45019,19096,5752,15568
1/20/2023,2023,1,20,12,44182,19559,4921,14670
1/20/2023,2023,1,20,13,43866,20175,4301,13925
1/20/2023,2023,1,20,14,43314,20881,4156,12936
1/20/2023,2023,1,20,15,42993,21603,3634,12561
1/20/2023,2023,1,20,16,43413,22259,2648,12783
1/20/2023,2023,1,20,17,44450,22713,1117,13698
1/20/2023,2023,1,20,18,45614,23161,21,14691
1/20/2023,2023,1,20,19,45239,24109,0,14081
1/20/2023,2023,1,20,20,44811,24120,0,13810
1/20/2023,2023,1,20,21,43848,24323,0,13337
1/20/2023,2023,1,20,22,42428,24316,0,12984
1/20/2023,2023,1,20,23,38964,11790,0,12636
1/20/2024,2024,1,20,0,60926,10041,0,31816
1/20/2024,2024,1,20,1,61013,9715,0,32056
1/20/2024,2024,1,20,2,61201,9427,0,32378
1/20/2024,2024,1,20,3,61713,9240,0,32602
1/20/2024,2024,1,20,4,62889,9476,0,33428
1/20/2024,2024,1,20,5,64599,9635,0,34040
1/20/2024,2024,1,20,6,66627,9358,0,34836
1/20/2024,2024,1,20,7,68364,8893,269,35394
1/20/2024,2024,1,20,8,68722,8189,5754,33191
1/20/2024,2024,1,20,9,67001,7277,12661,29401
1/20/2024,2024,1,20,10,64581,6289,13897,28147
1/20/2024,2024,1,20,11,61968,5082,13520,27199
1/20/2024,2024,1,20,12,59247,4717,13112,25611
1/20/2024,2024,1,20,13,57266,5313,12787,23958
1/20/2024,2024,1,20,14,56010,6353,12218,22579
1/20/2024,2024,1,20,15,55415,7431,11037,21799
1/20/2024,2024,1,20,16,56072,8386,7329,23720
1/20/2024,2024,1,20,17,58390,9256,1479,28461
1/20/2024,2024,1,20,18,60709,10117,4,30531
1/20/2024,2024,1,20,19,61562,11491,0,30245
1/20/2024,2024,1,20,20,61517,12618,0,29603
1/20/2024,2024,1,20,21,60880,14042,0,28852
1/20/2024,2024,1,20,22,59951,15042,0,28283
1/20/2024,2024,1,20,23,61278,10263,0,27881
1/21/2021,2021,1,21,0,36776,13005,1,16677
1/21/2021,2021,1,21,1,35688,13620,1,15966
1/21/2021,2021,1,21,2,34983,13695,1,15894
1/21/2021,2021,1,21,3,34738,13153,1,16040
1/21/2021,2021,1,21,4,34947,13822,1,16346
1/21/2021,2021,1,21,5,35925,13320,1,17533
1/21/2021,2021,1,21,6,38382,12712,1,19891
1/21/2021,2021,1,21,7,41293,11410,1,21968
1/21/2021,2021,1,21,8,41977,9141,6,23109
1/21/2021,2021,1,21,9,41893,8047,185,23628
1/21/2021,2021,1,21,10,42006,6766,442,24160
1/21/2021,2021,1,21,11,41730,5125,799,24403
1/21/2021,2021,1,21,12,41448,3806,1008,24587
1/21/2021,2021,1,21,13,41072,2958,1394,24694
1/21/2021,2021,1,21,14,40675,2465,1431,24252
1/21/2021,2021,1,21,15,40256,2695,2218,23307
1/21/2021,2021,1,21,16,40234,3513,2256,23312
1/21/2021,2021,1,21,17,40606,3764,977,24220
1/21/2021,2021,1,21,18,42135,3733,17,24555
1/21/2021,2021,1,21,19,42018,4349,0,23922
1/21/2021,2021,1,21,20,41212,5242,0,23545
1/21/2021,2021,1,21,21,40122,5709,0,22921
1/21/2021,2021,1,21,22,38436,5902,0,21152
1/21/2021,2021,1,21,23,36462,7182,0,18495
1/21/2022,2022,1,21,0,54176,6965,0,28564
1/21/2022,2022,1,21,1,53632,7266,0,27829
1/21/2022,2022,1,21,2,53544,6945,0,27851
1/21/2022,2022,1,21,3,54178,6124,0,28709
1/21/2022,2022,1,21,4,55351,5678,0,29383
1/21/2022,2022,1,21,5,57881,5658,0,30751
1/21/2022,2022,1,21,6,61511,5631,0,32384
1/21/2022,2022,1,21,7,63503,5787,33,33098
1/21/2022,2022,1,21,8,62886,5902,2141,32513
1/21/2022,2022,1,21,9,61311,4599,5907,31126
1/21/2022,2022,1,21,10,59273,4691,6556,29773
1/21/2022,2022,1,21,11,56503,5108,6572,28327
1/21/2022,2022,1,21,12,53514,6039,6620,26437
1/21/2022,2022,1,21,13,51062,6143,6705,25023
1/21/2022,2022,1,21,14,48805,6761,6853,22903
1/21/2022,2022,1,21,15,47597,7233,7167,21792
1/21/2022,2022,1,21,16,47535,7331,6057,22311
1/21/2022,2022,1,21,17,49129,7224,1844,25796
1/21/2022,2022,1,21,18,52244,8758,18,27701
1/21/2022,2022,1,21,19,53310,11846,0,26971
1/21/2022,2022,1,21,20,53842,14093,0,26337
1/21/2022,2022,1,21,21,53754,15432,0,25621
1/21/2022,2022,1,21,22,52851,15029,0,25276
1/21/2022,2022,1,21,23,55332,6899,0,24653
1/21/2023,2023,1,21,0,39358,21008,0,12838
1/21/2023,2023,1,21,1,38413,18240,0,13418
1/21/2023,2023,1,21,2,37763,15184,0,14595
1/21/2023,2023,1,21,3,37518,12612,0,15845
1/21/2023,2023,1,21,4,37856,11503,0,16837
1/21/2023,2023,1,21,5,38478,10246,0,17790
1/21/2023,2023,1,21,6,39806,10165,0,17575
1/21/2023,2023,1,21,7,41330,10474,16,18230
1/21/2023,2023,1,21,8,42745,10208,1986,18149
1/21/2023,2023,1,21,9,43986,9670,5878,17231
1/21/2023,2023,1,21,10,44621,11822,6480,16374
1/21/2023,2023,1,21,11,44452,12533,6512,16069
1/21/2023,2023,1,21,12,43411,13092,6521,15253
1/21/2023,2023,1,21,13,42125,14551,6063,14170
1/21/2023,2023,1,21,14,41099,16367,4860,13236
1/21/2023,2023,1,21,15,40804,16985,4271,12837
1/21/2023,2023,1,21,16,40917,17303,3343,13149
1/21/2023,2023,1,21,17,41848,17713,1368,14002
1/21/2023,2023,1,21,18,43186,17388,16,15382
1/21/2023,2023,1,21,19,43351,18496,0,14945
1/21/2023,2023,1,21,20,43220,19633,0,14404
1/21/2023,2023,1,21,21,42669,20046,0,14097
1/21/2023,2023,1,21,22,41990,19707,0,13785
1/21/2023,2023,1,21,23,40705,23404,0,13817
1/21/2024,2024,1,21,0,56987,13817,0,27166
1/21/2024,2024,1,21,1,56035,13834,0,26375
1/21/2024,2024,1,21,2,55723,13677,0,26246
1/21/2024,2024,1,21,3,55680,13126,0,26636
1/21/2024,2024,1,21,4,55791,13384,0,26670
1/21/2024,2024,1,21,5,56545,14962,0,26546
1/21/2024,2024,1,21,6,57801,15723,0,27267
1/21/2024,2024,1,21,7,59237,16782,29,27408
1/21/2024,2024,1,21,8,60490,17950,555,27028
1/21/2024,2024,1,21,9,61633,19947,1564,25741
1/21/2024,2024,1,21,10,62040,20754,2699,24776
1/21/2024,2024,1,21,11,61304,20117,3619,24523
1/21/2024,2024,1,21,12,61000,19675,4206,24009
1/21/2024,2024,1,21,13,60572,19192,4071,23783
1/21/2024,2024,1,21,14,59906,17766,3290,24563
1/21/2024,2024,1,21,15,59856,17601,2807,25038
1/21/2024,2024,1,21,16,60436,17632,2525,25698
1/21/2024,2024,1,21,17,61500,17747,520,27362
1/21/2024,2024,1,21,18,62433,16392,2,28624
1/21/2024,2024,1,21,19,62135,14854,0,29014
1/21/2024,2024,1,21,20,60933,13159,0,28964
1/21/2024,2024,1,21,21,59846,13085,0,28517
1/21/2024,2024,1,21,22,58223,14329,0,27366
1/21/2024,2024,1,21,23,58395,14517,0,26170
1/22/2021,2021,1,22,0,34710,8152,0,16711
1/22/2021,2021,1,22,1,33537,8838,0,16597
1/22/2021,2021,1,22,2,32813,6955,0,17161
1/22/2021,2021,1,22,3,32728,6431,0,17544
1/22/2021,2021,1,22,4,32966,5889,0,18277
1/22/2021,2021,1,22,5,33985,6120,0,19235
1/22/2021,2021,1,22,6,36517,6403,0,20641
1/22/2021,2021,1,22,7,39485,6227,0,21849
1/22/2021,2021,1,22,8,40440,6392,43,22065
1/22/2021,2021,1,22,9,40706,4934,2299,22043
1/22/2021,2021,1,22,10,40813,3293,3345,22597
1/22/2021,2021,1,22,11,40706,2453,3356,23284
1/22/2021,2021,1,22,12,40738,1725,3293,23592
1/22/2021,2021,1,22,13,40630,1135,3258,23625
1/22/2021,2021,1,22,14,40420,997,3457,23651
1/22/2021,2021,1,22,15,40328,989,3507,23643
1/22/2021,2021,1,22,16,40631,997,3464,23816
1/22/2021,2021,1,22,17,40776,1259,2301,24633
1/22/2021,2021,1,22,18,41596,1946,91,24588
1/22/2021,2021,1,22,19,41880,3165,0,23911
1/22/2021,2021,1,22,20,40855,3983,0,23056
1/22/2021,2021,1,22,21,39703,4166,0,22353
1/22/2021,2021,1,22,22,38522,4195,0,22083
1/22/2021,2021,1,22,23,36796,4060,0,21460
1/22/2022,2022,1,22,0,50846,13051,0,23801
1/22/2022,2022,1,22,1,50676,11450,0,24496
1/22/2022,2022,1,22,2,50859,9696,0,25496
1/22/2022,2022,1,22,3,51547,8215,0,26848
1/22/2022,2022,1,22,4,52541,7245,0,28342
1/22/2022,2022,1,22,5,54172,6393,0,29786
1/22/2022,2022,1,22,6,56279,6477,0,30420
1/22/2022,2022,1,22,7,57993,6264,66,31535
1/22/2022,2022,1,22,8,57810,4704,2240,31155
1/22/2022,2022,1,22,9,55816,3120,4776,29602
1/22/2022,2022,1,22,10,53400,2288,4359,29046
1/22/2022,2022,1,22,11,51013,1914,4106,28002
1/22/2022,2022,1,22,12,48397,1924,4136,26527
1/22/2022,2022,1,22,13,45996,1731,3966,25156
1/22/2022,2022,1,22,14,44230,1665,3912,24655
1/22/2022,2022,1,22,15,43397,1897,3306,24754
1/22/2022,2022,1,22,16,43483,2225,2379,24956
1/22/2022,2022,1,22,17,45001,2369,615,26267
1/22/2022,2022,1,22,18,47750,2427,5,28080
1/22/2022,2022,1,22,19,48590,2784,0,28199
1/22/2022,2022,1,22,20,48806,3349,0,27899
1/22/2022,2022,1,22,21,48519,4281,0,27197
1/22/2022,2022,1,22,22,47699,5917,0,25861
1/22/2022,2022,1,22,23,51639,14368,0,24788
1/22/2023,2023,1,22,0,39621,16737,0,13953
1/22/2023,2023,1,22,1,39129,15818,0,14081
1/22/2023,2023,1,22,2,38832,15020,0,14422
1/22/2023,2023,1,22,3,38922,14403,0,15410
1/22/2023,2023,1,22,4,39578,13801,0,16278
1/22/2023,2023,1,22,5,40789,13535,0,17077
1/22/2023,2023,1,22,6,42445,13433,0,17277
1/22/2023,2023,1,22,7,44129,12753,97,18486
1/22/2023,2023,1,22,8,45271,11334,3698,18489
1/22/2023,2023,1,22,9,45133,8614,8904,17401
1/22/2023,2023,1,22,10,44152,7121,9638,17499
1/22/2023,2023,1,22,11,42804,5048,9271,18080
1/22/2023,2023,1,22,12,41856,4874,9053,17884
1/22/2023,2023,1,22,13,40920,5657,9155,17094
1/22/2023,2023,1,22,14,40383,5375,9486,16844
1/22/2023,2023,1,22,15,40322,4109,9783,17171
1/22/2023,2023,1,22,16,40468,2599,8184,18544
1/22/2023,2023,1,22,17,41784,1452,2377,22758
1/22/2023,2023,1,22,18,43588,1766,19,25117
1/22/2023,2023,1,22,19,44856,3394,0,25120
1/22/2023,2023,1,22,20,45280,5542,0,24147
1/22/2023,2023,1,22,21,45542,8238,0,22779
1/22/2023,2023,1,22,22,44151,11619,0,20269
1/22/2023,2023,1,22,23,40723,17990,0,18241
1/22/2024,2024,1,22,0,53833,13515,0,26088
1/22/2024,2024,1,22,1,52832,11797,0,26548
1/22/2024,2024,1,22,2,52199,10548,0,26801
1/22/2024,2024,1,22,3,51995,8918,0,27643
1/22/2024,2024,1,22,4,52294,7032,0,28792
1/22/2024,2024,1,22,5,54136,6166,0,29922
1/22/2024,2024,1,22,6,56717,4900,0,31642
1/22/2024,2024,1,22,7,57965,4766,2,32603
1/22/2024,2024,1,22,8,57575,4576,425,32429
1/22/2024,2024,1,22,9,57494,3886,1703,32289
1/22/2024,2024,1,22,10,57530,3698,3297,32029
1/22/2024,2024,1,22,11,57470,3838,4690,31578
1/22/2024,2024,1,22,12,56359,4412,5557,30081
1/22/2024,2024,1,22,13,54935,5213,5892,28637
1/22/2024,2024,1,22,14,53632,5190,6302,27761
1/22/2024,2024,1,22,15,52427,4376,6132,27443
1/22/2024,2024,1,22,16,52400,4127,4343,28667
1/22/2024,2024,1,22,17,53448,4999,1025,30786
1/22/2024,2024,1,22,18,54712,6338,3,31283
1/22/2024,2024,1,22,19,54112,7665,0,30464
1/22/2024,2024,1,22,20,52912,9198,0,29178
1/22/2024,2024,1,22,21,51288,10487,0,27374
1/22/2024,2024,1,22,22,48612,10849,0,26079
1/22/2024,2024,1,22,23,55710,14478,0,25197
1/23/2021,2021,1,23,0,35133,3818,0,20419
1/23/2021,2021,1,23,1,33985,3673,0,19872
1/23/2021,2021,1,23,2,33213,3728,0,19626
1/23/2021,2021,1,23,3,32864,3781,0,19756
1/23/2021,2021,1,23,4,32810,3663,0,19894
1/23/2021,2021,1,23,5,33261,3945,0,20079
1/23/2021,2021,1,23,6,34331,4469,0,20640
1/23/2021,2021,1,23,7,35812,5061,0,21347
1/23/2021,2021,1,23,8,37179,4756,8,22128
1/23/2021,2021,1,23,9,38699,5387,455,22400
1/23/2021,2021,1,23,10,39747,5619,906,21853
1/23/2021,2021,1,23,11,40020,6017,1741,21016
1/23/2021,2021,1,23,12,40069,6358,2611,20520
1/23/2021,2021,1,23,13,39637,6848,2808,19804
1/23/2021,2021,1,23,14,39053,7176,2710,19136
1/23/2021,2021,1,23,15,38641,7346,2865,19076
1/23/2021,2021,1,23,16,38774,7297,2595,19612
1/23/2021,2021,1,23,17,38940,7320,1464,20562
1/23/2021,2021,1,23,18,40262,8274,39,20955
1/23/2021,2021,1,23,19,40354,10134,0,20089
1/23/2021,2021,1,23,20,39701,11546,0,18629
1/23/2021,2021,1,23,21,38912,13212,0,17729
1/23/2021,2021,1,23,22,37685,13952,0,16992
1/23/2021,2021,1,23,23,36372,14098,0,15828
1/23/2022,2022,1,23,0,45881,7049,0,23389
1/23/2022,2022,1,23,1,45330,6935,0,22950
1/23/2022,2022,1,23,2,45120,7180,0,22548
1/23/2022,2022,1,23,3,45203,7539,0,22595
1/23/2022,2022,1,23,4,45486,7638,0,23292
1/23/2022,2022,1,23,5,46283,7386,0,23985
1/23/2022,2022,1,23,6,47444,7022,0,24853
1/23/2022,2022,1,23,7,48605,6364,38,25907
1/23/2022,2022,1,23,8,49034,5855,1136,26099
1/23/2022,2022,1,23,9,48032,3832,3057,26164
1/23/2022,2022,1,23,10,46240,2378,3911,25624
1/23/2022,2022,1,23,11,44046,1703,4453,24929
1/23/2022,2022,1,23,12,42483,1597,4735,24048
1/23/2022,2022,1,23,13,41049,1697,5039,22605
1/23/2022,2022,1,23,14,39901,1582,4847,21981
1/23/2022,2022,1,23,15,39500,1390,4818,21806
1/23/2022,2022,1,23,16,39821,1570,3734,22582
1/23/2022,2022,1,23,17,41276,1857,1036,24381
1/23/2022,2022,1,23,18,43707,2731,9,25749
1/23/2022,2022,1,23,19,44100,4236,0,25201
1/23/2022,2022,1,23,20,43552,5246,0,24359
1/23/2022,2022,1,23,21,42878,6248,0,23201
1/23/2022,2022,1,23,22,41038,8021,0,21067
1/23/2022,2022,1,23,23,46672,6927,0,19201
1/23/2023,2023,1,23,0,42215,16675,0,16624
1/23/2023,2023,1,23,1,42179,17834,0,15705
1/23/2023,2023,1,23,2,42548,18492,0,15567
1/23/2023,2023,1,23,3,43188,19191,0,15784
1/23/2023,2023,1,23,4,44774,19368,0,16596
1/23/2023,2023,1,23,5,48023,19959,0,18213
1/23/2023,2023,1,23,6,52413,19867,0,20689
1/23/2023,2023,1,23,7,54700,20362,177,21669
1/23/2023,2023,1,23,8,53444,19952,3750,19583
1/23/2023,2023,1,23,9,51119,17676,8226,17481
1/23/2023,2023,1,23,10,48887,18523,8667,15915
1/23/2023,2023,1,23,11,47169,19330,8390,15040
1/23/2023,2023,1,23,12,45664,19444,8209,14279
1/23/2023,2023,1,23,13,44488,19901,7894,13506
1/23/2023,2023,1,23,14,43665,20323,7193,13186
1/23/2023,2023,1,23,15,43474,20905,5988,13635
1/23/2023,2023,1,23,16,44100,21099,3947,14987
1/23/2023,2023,1,23,17,45853,21330,831,17651
1/23/2023,2023,1,23,18,47762,20345,2,20006
1/23/2023,2023,1,23,19,48098,20393,0,20039
1/23/2023,2023,1,23,20,47360,20789,0,19243
1/23/2023,2023,1,23,21,45939,20931,0,18299
1/23/2023,2023,1,23,22,43910,21303,0,16710
1/23/2023,2023,1,23,23,42893,14376,0,15963
1/23/2024,2024,1,23,0,44700,10312,0,24029
1/23/2024,2024,1,23,1,43645,9052,0,24299
1/23/2024,2024,1,23,2,43269,7951,0,24880
1/23/2024,2024,1,23,3,43277,6400,0,26017
1/23/2024,2024,1,23,4,44030,5895,0,26505
1/23/2024,2024,1,23,5,45919,5962,0,27012
1/23/2024,2024,1,23,6,49173,5556,0,28738
1/23/2024,2024,1,23,7,50539,4471,9,29597
1/23/2024,2024,1,23,8,50329,3646,425,29625
1/23/2024,2024,1,23,9,50786,3240,1801,29532
1/23/2024,2024,1,23,10,51156,3207,3448,29022
1/23/2024,2024,1,23,11,50944,3918,4399,28163
1/23/2024,2024,1,23,12,50538,4040,4731,27664
1/23/2024,2024,1,23,13,49930,3670,4451,27835
1/23/2024,2024,1,23,14,49086,3517,4266,27194
1/23/2024,2024,1,23,15,48476,3567,3026,27112
1/23/2024,2024,1,23,16,48729,3579,1995,28002
1/23/2024,2024,1,23,17,49705,3720,577,29148
1/23/2024,2024,1,23,18,50686,4803,87,28899
1/23/2024,2024,1,23,19,50448,5676,0,27975
1/23/2024,2024,1,23,20,49577,5433,0,27644
1/23/2024,2024,1,23,21,47889,4974,0,26715
1/23/2024,2024,1,23,22,45766,4515,0,25548
1/23/2024,2024,1,23,23,46449,10505,0,24706
1/24/2021,2021,1,24,0,34681,13952,0,15282
1/24/2021,2021,1,24,1,33726,13585,0,15421
1/24/2021,2021,1,24,2,32706,12192,0,15425
1/24/2021,2021,1,24,3,32076,11896,0,15652
1/24/2021,2021,1,24,4,31982,10765,0,16610
1/24/2021,2021,1,24,5,32110,10554,0,16812
1/24/2021,2021,1,24,6,32574,9720,0,17513
1/24/2021,2021,1,24,7,33447,9506,0,19188
1/24/2021,2021,1,24,8,34653,7702,9,20299
1/24/2021,2021,1,24,9,36031,7592,563,20588
1/24/2021,2021,1,24,10,37462,7393,1047,20609
1/24/2021,2021,1,24,11,38036,8827,2180,19504
1/24/2021,2021,1,24,12,38641,10067,2335,19032
1/24/2021,2021,1,24,13,39040,10278,2484,19001
1/24/2021,2021,1,24,14,39254,10432,2785,18227
1/24/2021,2021,1,24,15,39049,10941,2359,17828
1/24/2021,2021,1,24,16,39050,11732,2301,18469
1/24/2021,2021,1,24,17,39284,11845,597,20367
1/24/2021,2021,1,24,18,40838,12972,40,20179
1/24/2021,2021,1,24,19,41261,14652,0,19858
1/24/2021,2021,1,24,20,40624,15232,0,19647
1/24/2021,2021,1,24,21,39719,14560,0,19634
1/24/2021,2021,1,24,22,38222,13071,0,18979
1/24/2021,2021,1,24,23,36013,13175,0,16740
1/24/2022,2022,1,24,0,38236,10961,0,17719
1/24/2022,2022,1,24,1,37725,12172,0,16825
1/24/2022,2022,1,24,2,37643,12528,0,16565
1/24/2022,2022,1,24,3,38100,12426,0,16834
1/24/2022,2022,1,24,4,39124,11933,0,18160
1/24/2022,2022,1,24,5,41335,11276,0,20107
1/24/2022,2022,1,24,6,44796,9845,0,22491
1/24/2022,2022,1,24,7,46712,9263,6,24043
1/24/2022,2022,1,24,8,46778,8162,1286,24142
1/24/2022,2022,1,24,9,46836,5739,4382,23721
1/24/2022,2022,1,24,10,46954,4278,5334,23669
1/24/2022,2022,1,24,11,46806,4787,5347,23322
1/24/2022,2022,1,24,12,46344,4958,5253,23180
1/24/2022,2022,1,24,13,45880,4685,5456,22912
1/24/2022,2022,1,24,14,45364,4993,5629,22259
1/24/2022,2022,1,24,15,44915,5377,5551,21944
1/24/2022,2022,1,24,16,45327,4402,5102,22378
1/24/2022,2022,1,24,17,46600,3648,1873,25044
1/24/2022,2022,1,24,18,48192,2983,23,27080
1/24/2022,2022,1,24,19,47828,3239,0,26534
1/24/2022,2022,1,24,20,47007,3577,0,26157
1/24/2022,2022,1,24,21,45571,4052,0,25154
1/24/2022,2022,1,24,22,43361,3730,0,24458
1/24/2022,2022,1,24,23,39304,9649,0,23384
1/24/2023,2023,1,24,0,40358,17490,0,16250
1/24/2023,2023,1,24,1,39628,14615,0,17963
1/24/2023,2023,1,24,2,39474,12910,0,19173
1/24/2023,2023,1,24,3,39676,12159,0,19898
1/24/2023,2023,1,24,4,40561,11389,0,20619
1/24/2023,2023,1,24,5,42803,11203,0,21588
1/24/2023,2023,1,24,6,46497,12304,0,22622
1/24/2023,2023,1,24,7,48527,13222,2,23592
1/24/2023,2023,1,24,8,48958,11660,162,24727
1/24/2023,2023,1,24,9,49762,11309,668,25204
1/24/2023,2023,1,24,10,50138,10149,1450,25792
1/24/2023,2023,1,24,11,50105,10424,1775,25322
1/24/2023,2023,1,24,12,49955,11675,1784,24571
1/24/2023,2023,1,24,13,49390,12550,2651,23628
1/24/2023,2023,1,24,14,48105,13221,3060,22313
1/24/2023,2023,1,24,15,47480,15167,3017,21016
1/24/2023,2023,1,24,16,48249,16952,2905,20440
1/24/2023,2023,1,24,17,49491,17367,1203,20873
1/24/2023,2023,1,24,18,51222,16813,16,22355
1/24/2023,2023,1,24,19,51781,17579,0,22310
1/24/2023,2023,1,24,20,51821,18558,0,21666
1/24/2023,2023,1,24,21,50801,19831,0,19934
1/24/2023,2023,1,24,22,48720,20114,0,18630
1/24/2023,2023,1,24,23,41895,20154,0,17920
1/24/2024,2024,1,24,0,41515,3596,0,23204
1/24/2024,2024,1,24,1,40979,3875,0,22172
1/24/2024,2024,1,24,2,40652,3716,0,21920
1/24/2024,2024,1,24,3,40625,4589,0,21530
1/24/2024,2024,1,24,4,41318,4412,0,22093
1/24/2024,2024,1,24,5,43435,3308,0,24573
1/24/2024,2024,1,24,6,46721,2800,0,26544
1/24/2024,2024,1,24,7,48512,2101,3,28078
1/24/2024,2024,1,24,8,48647,1916,756,27824
1/24/2024,2024,1,24,9,48980,2153,2571,27211
1/24/2024,2024,1,24,10,49059,2106,3718,26624
1/24/2024,2024,1,24,11,48924,1981,4567,26529
1/24/2024,2024,1,24,12,48585,2033,4879,25968
1/24/2024,2024,1,24,13,48095,2128,4739,25575
1/24/2024,2024,1,24,14,47810,2187,4110,25658
1/24/2024,2024,1,24,15,47646,2460,3137,25724
1/24/2024,2024,1,24,16,48100,2536,2478,26469
1/24/2024,2024,1,24,17,49110,2596,1069,27916
1/24/2024,2024,1,24,18,50170,2731,28,29083
1/24/2024,2024,1,24,19,49842,2827,0,28743
1/24/2024,2024,1,24,20,48994,3137,0,28263
1/24/2024,2024,1,24,21,47370,3593,0,26797
1/24/2024,2024,1,24,22,45012,3746,0,25568
1/24/2024,2024,1,24,23,43589,3512,0,24182
1/25/2021,2021,1,25,0,33940,14846,0,13485
1/25/2021,2021,1,25,1,32891,16570,0,12656
1/25/2021,2021,1,25,2,31899,15225,0,13392
1/25/2021,2021,1,25,3,31747,15235,0,12875
1/25/2021,2021,1,25,4,31879,15320,0,12993
1/25/2021,2021,1,25,5,32711,16755,0,14019
1/25/2021,2021,1,25,6,35206,17475,0,15963
1/25/2021,2021,1,25,7,38326,17770,0,17449
1/25/2021,2021,1,25,8,39193,17206,94,17153
1/25/2021,2021,1,25,9,39876,16081,2793,16568
1/25/2021,2021,1,25,10,40476,15848,3218,16393
1/25/2021,2021,1,25,11,40847,17134,2719,16531
1/25/2021,2021,1,25,12,41123,16834,2356,17173
1/25/2021,2021,1,25,13,41095,16703,2215,16939
1/25/2021,2021,1,25,14,40743,16217,2284,16505
1/25/2021,2021,1,25,15,40269,16425,1612,16144
1/25/2021,2021,1,25,16,40308,16934,1714,15929
1/25/2021,2021,1,25,17,40312,17434,954,16907
1/25/2021,2021,1,25,18,41269,14423,143,19935
1/25/2021,2021,1,25,19,42030,13571,0,19741
1/25/2021,2021,1,25,20,41039,12729,0,19526
1/25/2021,2021,1,25,21,40078,12451,0,19520
1/25/2021,2021,1,25,22,38289,11360,0,19340
1/25/2021,2021,1,25,23,36231,8821,0,19101
1/25/2022,2022,1,25,0,40061,4657,0,22709
1/25/2022,2022,1,25,1,39395,5997,0,21460
1/25/2022,2022,1,25,2,39098,7766,0,19976
1/25/2022,2022,1,25,3,39425,9429,0,19381
1/25/2022,2022,1,25,4,40489,10690,0,19500
1/25/2022,2022,1,25,5,43057,11730,0,20352
1/25/2022,2022,1,25,6,47090,13149,0,21825
1/25/2022,2022,1,25,7,49004,13364,38,22580
1/25/2022,2022,1,25,8,48456,11926,2304,21900
1/25/2022,2022,1,25,9,47519,10314,5979,20843
1/25/2022,2022,1,25,10,46305,10344,6528,20019
1/25/2022,2022,1,25,11,45042,9218,6437,19854
1/25/2022,2022,1,25,12,43651,8273,6305,19878
1/25/2022,2022,1,25,13,42618,7414,6365,19894
1/25/2022,2022,1,25,14,42034,7244,6587,19447
1/25/2022,2022,1,25,15,41719,7798,6708,18954
1/25/2022,2022,1,25,16,42130,9238,5871,18587
1/25/2022,2022,1,25,17,43644,12044,2110,19842
1/25/2022,2022,1,25,18,45890,15363,74,20594
1/25/2022,2022,1,25,19,46353,17956,46,19537
1/25/2022,2022,1,25,20,46165,18867,46,19145
1/25/2022,2022,1,25,21,45385,19261,46,18509
1/25/2022,2022,1,25,22,43695,19485,46,17246
1/25/2022,2022,1,25,23,41390,3919,0,16366
1/25/2023,2023,1,25,0,45659,19409,0,17346
1/25/2023,2023,1,25,1,45158,18988,0,17255
1/25/2023,2023,1,25,2,44959,17973,0,17644
1/25/2023,2023,1,25,3,45100,16942,0,18062
1/25/2023,2023,1,25,4,46348,17214,0,18516
1/25/2023,2023,1,25,5,48798,17737,0,19424
1/25/2023,2023,1,25,6,52771,17268,0,21685
1/25/2023,2023,1,25,7,54480,17341,91,22676
1/25/2023,2023,1,25,8,53559,15620,2902,22033
1/25/2023,2023,1,25,9,52310,13877,6597,21006
1/25/2023,2023,1,25,10,50872,14732,7362,20033
1/25/2023,2023,1,25,11,49483,15130,7143,19107
1/25/2023,2023,1,25,12,48286,13788,7517,18870
1/25/2023,2023,1,25,13,47292,13160,7172,18555
1/25/2023,2023,1,25,14,46539,12175,7752,17997
1/25/2023,2023,1,25,15,46116,11537,7685,18137
1/25/2023,2023,1,25,16,46518,10459,6595,19486
1/25/2023,2023,1,25,17,47843,8039,2142,23305
1/25/2023,2023,1,25,18,50609,7011,26,27372
1/25/2023,2023,1,25,19,51373,7967,0,27423
1/25/2023,2023,1,25,20,51622,8925,0,27027
1/25/2023,2023,1,25,21,51079,9062,0,26514
1/25/2023,2023,1,25,22,49107,9283,8,25139
1/25/2023,2023,1,25,23,46872,19742,0,23500
1/25/2024,2024,1,25,0,41465,4839,0,22570
1/25/2024,2024,1,25,1,40569,5046,0,21622
1/25/2024,2024,1,25,2,40142,4917,0,21101
1/25/2024,2024,1,25,3,39996,4880,0,20981
1/25/2024,2024,1,25,4,40839,4857,0,21648
1/25/2024,2024,1,25,5,43049,4379,0,23578
1/25/2024,2024,1,25,6,46402,4494,0,25768
1/25/2024,2024,1,25,7,48118,3536,149,27459
1/25/2024,2024,1,25,8,48115,2186,3037,26976
1/25/2024,2024,1,25,9,47396,1309,6831,25135
1/25/2024,2024,1,25,10,46718,1135,8300,23899
1/25/2024,2024,1,25,11,46302,1328,9059,22921
1/25/2024,2024,1,25,12,45705,2255,9887,21455
1/25/2024,2024,1,25,13,45432,3233,10139,20658
1/25/2024,2024,1,25,14,45148,3486,10235,20425
1/25/2024,2024,1,25,15,44886,3053,10027,20694
1/25/2024,2024,1,25,16,45233,2685,8079,21809
1/25/2024,2024,1,25,17,46330,2928,2428,25462
1/25/2024,2024,1,25,18,48120,3199,10,28244
1/25/2024,2024,1,25,19,48337,4654,0,27872
1/25/2024,2024,1,25,20,47748,6314,0,26547
1/25/2024,2024,1,25,21,46560,8881,0,24247
1/25/2024,2024,1,25,22,44603,10603,0,22364
1/25/2024,2024,1,25,23,42863,3805,0,20302
1/26/2021,2021,1,26,0,34449,8266,0,18435
1/26/2021,2021,1,26,1,33559,7766,0,17432
1/26/2021,2021,1,26,2,33323,8894,0,15870
1/26/2021,2021,1,26,3,33118,10297,0,15647
1/26/2021,2021,1,26,4,33706,9664,0,17176
1/26/2021,2021,1,26,5,35354,8350,0,18555
1/26/2021,2021,1,26,6,38536,8776,0,20212
1/26/2021,2021,1,26,7,42350,9740,0,21530
1/26/2021,2021,1,26,8,43329,9102,127,21866
1/26/2021,2021,1,26,9,42734,6482,2651,21370
1/26/2021,2021,1,26,10,42022,5424,4128,21235
1/26/2021,2021,1,26,11,41263,4595,4275,21646
1/26/2021,2021,1,26,12,40661,3356,4153,21690
1/26/2021,2021,1,26,13,40215,2821,4072,21549
1/26/2021,2021,1,26,14,39883,2358,4055,21307
1/26/2021,2021,1,26,15,39568,2315,4225,21303
1/26/2021,2021,1,26,16,39587,2883,4017,20991
1/26/2021,2021,1,26,17,39717,5654,2487,20941
1/26/2021,2021,1,26,18,41240,8533,102,21635
1/26/2021,2021,1,26,19,42496,10450,0,20710
1/26/2021,2021,1,26,20,41828,9606,0,21730
1/26/2021,2021,1,26,21,41185,8033,0,21740
1/26/2021,2021,1,26,22,39453,6279,0,21385
1/26/2021,2021,1,26,23,37480,5695,0,20492
1/26/2022,2022,1,26,0,41235,17602,46,17010
1/26/2022,2022,1,26,1,41148,16418,46,17833
1/26/2022,2022,1,26,2,41583,15393,46,18557
1/26/2022,2022,1,26,3,42488,13915,46,19959
1/26/2022,2022,1,26,4,44202,13298,46,21968
1/26/2022,2022,1,26,5,47296,12324,46,24399
1/26/2022,2022,1,26,6,51691,11514,35,26481
1/26/2022,2022,1,26,7,53813,9922,41,28034
1/26/2022,2022,1,26,8,53294,7352,669,28699
1/26/2022,2022,1,26,9,51990,5578,1429,28602
1/26/2022,2022,1,26,10,50494,4558,1878,28149
1/26/2022,2022,1,26,11,48734,3870,2311,27650
1/26/2022,2022,1,26,12,46864,3335,2683,26699
1/26/2022,2022,1,26,13,45336,3170,2953,25624
1/26/2022,2022,1,26,14,44163,3330,2756,24511
1/26/2022,2022,1,26,15,43544,3489,2434,24198
1/26/2022,2022,1,26,16,44091,3589,1778,24725
1/26/2022,2022,1,26,17,45955,3385,596,26115
1/26/2022,2022,1,26,18,48631,3824,60,27752
1/26/2022,2022,1,26,19,49042,4131,51,27370
1/26/2022,2022,1,26,20,48695,3797,51,27157
1/26/2022,2022,1,26,21,47392,3647,51,26409
1/26/2022,2022,1,26,22,45114,3876,51,25124
1/26/2022,2022,1,26,23,42144,19429,46,23835
1/26/2023,2023,1,26,0,46319,11710,0,22289
1/26/2023,2023,1,26,1,46143,11257,0,22035
1/26/2023,2023,1,26,2,46476,11278,0,22229
1/26/2023,2023,1,26,3,47198,12438,0,22087
1/26/2023,2023,1,26,4,48811,12360,0,22938
1/26/2023,2023,1,26,5,51619,11923,0,24530
1/26/2023,2023,1,26,6,55964,11442,0,27458
1/26/2023,2023,1,26,7,57621,9963,205,29845
1/26/2023,2023,1,26,8,55730,8165,4125,28010
1/26/2023,2023,1,26,9,52575,5308,9336,25065
1/26/2023,2023,1,26,10,49575,4536,9963,24071
1/26/2023,2023,1,26,11,47070,3814,9867,22930
1/26/2023,2023,1,26,12,45229,4782,9641,21199
1/26/2023,2023,1,26,13,43693,5279,9517,19690
1/26/2023,2023,1,26,14,42810,5035,9644,19098
1/26/2023,2023,1,26,15,42285,4389,9811,18845
1/26/2023,2023,1,26,16,42701,3916,8423,19639
1/26/2023,2023,1,26,17,44430,3554,2661,23014
1/26/2023,2023,1,26,18,47555,4241,32,26031
1/26/2023,2023,1,26,19,48948,5142,0,25851
1/26/2023,2023,1,26,20,49509,6195,0,25535
1/26/2023,2023,1,26,21,48874,7888,0,24018
1/26/2023,2023,1,26,22,47569,9794,0,22022
1/26/2023,2023,1,26,23,47300,10411,24,19933
1/26/2024,2024,1,26,0,41309,10747,0,19569
1/26/2024,2024,1,26,1,40558,10776,0,18877
1/26/2024,2024,1,26,2,40138,10557,0,18792
1/26/2024,2024,1,26,3,40095,9821,0,19412
1/26/2024,2024,1,26,4,40832,9385,0,20093
1/26/2024,2024,1,26,5,43055,9688,0,21099
1/26/2024,2024,1,26,6,46226,9250,0,23199
1/26/2024,2024,1,26,7,47784,8048,68,25236
1/26/2024,2024,1,26,8,47901,6469,1254,25341
1/26/2024,2024,1,26,9,48060,5174,3645,24779
1/26/2024,2024,1,26,10,47942,4959,5753,24135
1/26/2024,2024,1,26,11,47605,4140,6966,23595
1/26/2024,2024,1,26,12,47533,5778,6156,22978
1/26/2024,2024,1,26,13,47415,6763,5447,22432
1/26/2024,2024,1,26,14,47358,7620,4987,21769
1/26/2024,2024,1,26,15,47344,8571,4568,21169
1/26/2024,2024,1,26,16,47514,9309,3340,21410
1/26/2024,2024,1,26,17,47684,9437,1033,22498
1/26/2024,2024,1,26,18,47945,8773,16,23723
1/26/2024,2024,1,26,19,47865,9273,0,23690
1/26/2024,2024,1,26,20,47512,10211,0,22698
1/26/2024,2024,1,26,21,46568,11532,0,21223
1/26/2024,2024,1,26,22,44836,13316,0,19528
1/26/2024,2024,1,26,23,42707,11037,0,18785
1/27/2021,2021,1,27,0,35781,5655,0,19653
1/27/2021,2021,1,27,1,34760,6708,0,18837
1/27/2021,2021,1,27,2,34255,6813,0,18168
1/27/2021,2021,1,27,3,34030,9698,0,16415
1/27/2021,2021,1,27,4,34487,13434,0,15221
1/27/2021,2021,1,27,5,36041,15619,0,16048
1/27/2021,2021,1,27,6,39106,16008,0,17641
1/27/2021,2021,1,27,7,43103,16421,0,19201
1/27/2021,2021,1,27,8,44106,15937,159,19236
1/27/2021,2021,1,27,9,43756,13912,3051,17778
1/27/2021,2021,1,27,10,43057,13971,4263,16669
1/27/2021,2021,1,27,11,42287,13944,4402,17163
1/27/2021,2021,1,27,12,41344,12186,4417,17935
1/27/2021,2021,1,27,13,40733,9478,4485,18591
1/27/2021,2021,1,27,14,40022,7320,4580,18989
1/27/2021,2021,1,27,15,39595,6231,4710,19541
1/27/2021,2021,1,27,16,39526,5061,4611,20540
1/27/2021,2021,1,27,17,40006,4720,2752,23001
1/27/2021,2021,1,27,18,42378,4211,163,25215
1/27/2021,2021,1,27,19,44165,5328,0,24382
1/27/2021,2021,1,27,20,44087,7967,0,23206
1/27/2021,2021,1,27,21,43689,8859,0,22116
1/27/2021,2021,1,27,22,42609,9337,0,20633
1/27/2021,2021,1,27,23,40983,9826,0,19246
1/27/2022,2022,1,27,0,41809,4888,51,22933
1/27/2022,2022,1,27,1,41186,4908,51,22875
1/27/2022,2022,1,27,2,41032,4971,51,22856
1/27/2022,2022,1,27,3,41362,5035,51,23150
1/27/2022,2022,1,27,4,42484,5081,18,24135
1/27/2022,2022,1,27,5,45116,4964,0,25630
1/27/2022,2022,1,27,6,48969,4635,0,27472
1/27/2022,2022,1,27,7,50837,4642,38,28716
1/27/2022,2022,1,27,8,50063,3711,731,28412
1/27/2022,2022,1,27,9,48568,3077,1994,27713
1/27/2022,2022,1,27,10,47223,2322,2838,26600
1/27/2022,2022,1,27,11,45763,1889,3937,25233
1/27/2022,2022,1,27,12,44272,2129,4293,24097
1/27/2022,2022,1,27,13,43211,2853,4697,22805
1/27/2022,2022,1,27,14,42289,3839,4986,21784
1/27/2022,2022,1,27,15,41701,4903,5150,21088
1/27/2022,2022,1,27,16,41979,5689,4425,20945
1/27/2022,2022,1,27,17,43343,6902,1675,22290
1/27/2022,2022,1,27,18,45582,9263,31,23347
1/27/2022,2022,1,27,19,46068,11839,0,22459
1/27/2022,2022,1,27,20,45983,14531,0,21331
1/27/2022,2022,1,27,21,45031,16511,0,20161
1/27/2022,2022,1,27,22,43275,16715,0,19225
1/27/2022,2022,1,27,23,43057,4265,51,18096
1/27/2023,2023,1,27,0,45708,14217,0,18631
1/27/2023,2023,1,27,1,45746,16187,0,17700
1/27/2023,2023,1,27,2,46006,17688,0,17152
1/27/2023,2023,1,27,3,46657,18775,0,17076
1/27/2023,2023,1,27,4,48038,19639,0,17462
1/27/2023,2023,1,27,5,50636,19634,0,18909
1/27/2023,2023,1,27,6,54542,19997,0,20761
1/27/2023,2023,1,27,7,55962,20353,118,21377
1/27/2023,2023,1,27,8,54540,18951,3160,20027
1/27/2023,2023,1,27,9,52306,15010,7770,18949
1/27/2023,2023,1,27,10,50123,14135,8720,17913
1/27/2023,2023,1,27,11,47809,14710,8556,17033
1/27/2023,2023,1,27,12,46064,14198,8587,16009
1/27/2023,2023,1,27,13,44836,13407,8525,15744
1/27/2023,2023,1,27,14,44021,13508,8523,15356
1/27/2023,2023,1,27,15,43568,13757,8454,14853
1/27/2023,2023,1,27,16,43800,14390,6921,15055
1/27/2023,2023,1,27,17,44837,14839,1981,17976
1/27/2023,2023,1,27,18,46568,17443,23,18602
1/27/2023,2023,1,27,19,46890,21082,5,16469
1/27/2023,2023,1,27,20,46659,21268,0,16430
1/27/2023,2023,1,27,21,45944,21761,0,15934
1/27/2023,2023,1,27,22,44595,22006,0,15303
1/27/2023,2023,1,27,23,46472,12092,0,14615
1/27/2024,2024,1,27,0,41785,15042,0,17164
1/27/2024,2024,1,27,1,40871,15648,0,16022
1/27/2024,2024,1,27,2,40440,17054,0,15016
1/27/2024,2024,1,27,3,40251,17749,0,14442
1/27/2024,2024,1,27,4,40807,17571,0,14774
1/27/2024,2024,1,27,5,41797,18228,0,14902
1/27/2024,2024,1,27,6,43196,17571,0,16100
1/27/2024,2024,1,27,7,44851,17249,115,17380
1/27/2024,2024,1,27,8,46446,16311,3306,17426
1/27/2024,2024,1,27,9,47855,14538,8499,16506
1/27/2024,2024,1,27,10,47945,14024,10025,16256
1/27/2024,2024,1,27,11,47412,13858,10779,15588
1/27/2024,2024,1,27,12,46922,15201,10625,14672
1/27/2024,2024,1,27,13,46116,16766,10239,13804
1/27/2024,2024,1,27,14,45021,17019,9348,13761
1/27/2024,2024,1,27,15,44519,16286,8614,14395
1/27/2024,2024,1,27,16,44641,15043,7257,15737
1/27/2024,2024,1,27,17,45953,11782,3316,19281
1/27/2024,2024,1,27,18,48104,8580,40,24426
1/27/2024,2024,1,27,19,48580,7072,0,25688
1/27/2024,2024,1,27,20,48647,5399,0,26681
1/27/2024,2024,1,27,21,48383,4414,0,26750
1/27/2024,2024,1,27,22,47703,3485,0,26608
1/27/2024,2024,1,27,23,43231,13822,0,26215
1/28/2021,2021,1,28,0,39678,10715,0,18200
1/28/2021,2021,1,28,1,39265,11448,0,17660
1/28/2021,2021,1,28,2,39510,12174,0,17592
1/28/2021,2021,1,28,3,39946,12704,0,17830
1/28/2021,2021,1,28,4,41046,12212,0,19178
1/28/2021,2021,1,28,5,43022,11929,0,20877
1/28/2021,2021,1,28,6,46775,12307,0,23392
1/28/2021,2021,1,28,7,50968,12249,0,24907
1/28/2021,2021,1,28,8,51747,11570,164,25250
1/28/2021,2021,1,28,9,50474,9582,1169,24901
1/28/2021,2021,1,28,10,48417,7462,2016,24047
1/28/2021,2021,1,28,11,46239,7065,3509,22884
1/28/2021,2021,1,28,12,44497,6732,3809,21408
1/28/2021,2021,1,28,13,42566,6506,3630,20264
1/28/2021,2021,1,28,14,41343,7664,3901,18952
1/28/2021,2021,1,28,15,40713,9041,3327,18647
1/28/2021,2021,1,28,16,40600,9918,2386,19202
1/28/2021,2021,1,28,17,40869,9949,848,20551
1/28/2021,2021,1,28,18,43286,10531,44,21865
1/28/2021,2021,1,28,19,45344,11812,0,21316
1/28/2021,2021,1,28,20,45231,13609,0,20654
1/28/2021,2021,1,28,21,44650,14462,0,19941
1/28/2021,2021,1,28,22,43517,15045,0,17930
1/28/2021,2021,1,28,23,41497,16182,0,16145
1/28/2022,2022,1,28,0,40662,16612,0,17453
1/28/2022,2022,1,28,1,40289,16706,0,17219
1/28/2022,2022,1,28,2,40638,16010,0,17701
1/28/2022,2022,1,28,3,41588,16128,0,18269
1/28/2022,2022,1,28,4,43162,16484,0,19382
1/28/2022,2022,1,28,5,46216,16008,0,21386
1/28/2022,2022,1,28,6,50480,15167,0,23401
1/28/2022,2022,1,28,7,52904,14174,63,24703
1/28/2022,2022,1,28,8,52513,12115,2681,24229
1/28/2022,2022,1,28,9,50980,8823,6734,23448
1/28/2022,2022,1,28,10,49176,7611,7267,22598
1/28/2022,2022,1,28,11,47248,8717,7284,20874
1/28/2022,2022,1,28,12,45504,9669,7281,19546
1/28/2022,2022,1,28,13,44172,9769,7412,18584
1/28/2022,2022,1,28,14,42981,9199,7625,18196
1/28/2022,2022,1,28,15,42240,8432,7846,18190
1/28/2022,2022,1,28,16,42174,7075,6950,19263
1/28/2022,2022,1,28,17,43329,4492,2540,23035
1/28/2022,2022,1,28,18,45971,2679,47,26561
1/28/2022,2022,1,28,19,46925,2170,0,27303
1/28/2022,2022,1,28,20,47384,2267,0,27731
1/28/2022,2022,1,28,21,47292,2803,0,27156
1/28/2022,2022,1,28,22,46447,3663,0,25988
1/28/2022,2022,1,28,23,41586,16526,0,25387
1/28/2023,2023,1,28,0,41719,21706,0,13820
1/28/2023,2023,1,28,1,40792,21776,0,13266
1/28/2023,2023,1,28,2,40061,21615,0,12910
1/28/2023,2023,1,28,3,39794,21255,0,13044
1/28/2023,2023,1,28,4,39933,21263,0,13251
1/28/2023,2023,1,28,5,40545,21224,0,13752
1/28/2023,2023,1,28,6,41407,20938,0,14744
1/28/2023,2023,1,28,7,42626,20643,25,16006
1/28/2023,2023,1,28,8,43917,20009,1176,16898
1/28/2023,2023,1,28,9,44961,18276,3923,17041
1/28/2023,2023,1,28,10,44942,17364,5272,16415
1/28/2023,2023,1,28,11,44514,17437,5293,15948
1/28/2023,2023,1,28,12,43588,18550,5617,14150
1/28/2023,2023,1,28,13,42521,19178,5608,13193
1/28/2023,2023,1,28,14,41747,19158,5389,12998
1/28/2023,2023,1,28,15,41465,19066,5161,13127
1/28/2023,2023,1,28,16,41077,18671,4003,13587
1/28/2023,2023,1,28,17,41290,17068,1229,15607
1/28/2023,2023,1,28,18,42313,17926,17,16711
1/28/2023,2023,1,28,19,42229,20415,0,15263
1/28/2023,2023,1,28,20,41677,22286,0,14299
1/28/2023,2023,1,28,21,40728,21793,0,14394
1/28/2023,2023,1,28,22,39341,20701,0,14285
1/28/2023,2023,1,28,23,43041,21775,0,13821
1/28/2024,2024,1,28,0,46421,1930,0,26029
1/28/2024,2024,1,28,1,46061,1802,0,25780
1/28/2024,2024,1,28,2,46003,2115,0,25645
1/28/2024,2024,1,28,3,46303,2592,0,25461
1/28/2024,2024,1,28,4,46976,3232,0,25248
1/28/2024,2024,1,28,5,48178,3718,0,25618
1/28/2024,2024,1,28,6,49964,4538,0,26164
1/28/2024,2024,1,28,7,51510,4294,404,27299
1/28/2024,2024,1,28,8,51597,4027,6954,24349
1/28/2024,2024,1,28,9,49507,3044,14396,20389
1/28/2024,2024,1,28,10,47308,2190,15138,19500
1/28/2024,2024,1,28,11,45138,2947,14761,18105
1/28/2024,2024,1,28,12,43746,3930,14471,17017
1/28/2024,2024,1,28,13,42735,3910,14664,16445
1/28/2024,2024,1,28,14,41930,3513,14830,16024
1/28/2024,2024,1,28,15,41609,3044,14664,16438
1/28/2024,2024,1,28,16,41805,2493,12281,17701
1/28/2024,2024,1,28,17,43337,2031,3745,22273
1/28/2024,2024,1,28,18,45891,2656,35,25962
1/28/2024,2024,1,28,19,46767,4029,0,25896
1/28/2024,2024,1,28,20,46762,5599,0,24998
1/28/2024,2024,1,28,21,46412,6909,0,23782
1/28/2024,2024,1,28,22,44874,8216,0,21801
1/28/2024,2024,1,28,23,46869,2531,0,19876
1/29/2021,2021,1,29,0,40154,16249,0,15548
1/29/2021,2021,1,29,1,39378,16733,0,15071
1/29/2021,2021,1,29,2,39182,17371,0,14920
1/29/2021,2021,1,29,3,39480,17754,0,15049
1/29/2021,2021,1,29,4,40142,18208,0,15905
1/29/2021,2021,1,29,5,41880,17933,0,17253
1/29/2021,2021,1,29,6,44968,18093,0,19649
1/29/2021,2021,1,29,7,48435,17769,0,21140
1/29/2021,2021,1,29,8,48709,17800,175,20527
1/29/2021,2021,1,29,9,47185,15936,1682,19601
1/29/2021,2021,1,29,10,45439,15304,2663,17471
1/29/2021,2021,1,29,11,43496,16421,2849,16121
1/29/2021,2021,1,29,12,41662,15559,3190,15585
1/29/2021,2021,1,29,13,40375,15440,2992,14721
1/29/2021,2021,1,29,14,39614,15588,2955,14231
1/29/2021,2021,1,29,15,38961,16214,2365,14315
1/29/2021,2021,1,29,16,38538,15302,1503,14848
1/29/2021,2021,1,29,17,38816,15630,713,16059
1/29/2021,2021,1,29,18,39983,14845,29,17600
1/29/2021,2021,1,29,19,40868,15426,0,16625
1/29/2021,2021,1,29,20,40326,17576,0,15283
1/29/2021,2021,1,29,21,39652,19481,0,13854
1/29/2021,2021,1,29,22,38432,19489,0,13063
1/29/2021,2021,1,29,23,37032,20990,0,12265
1/29/2022,2022,1,29,0,44958,5817,0,24244
1/29/2022,2022,1,29,1,45100,7658,0,23370
1/29/2022,2022,1,29,2,45492,9478,0,22793
1/29/2022,2022,1,29,3,46193,10708,0,22636
1/29/2022,2022,1,29,4,47301,11249,0,23100
1/29/2022,2022,1,29,5,48849,11527,0,23466
1/29/2022,2022,1,29,6,50979,11057,0,24140
1/29/2022,2022,1,29,7,52828,11229,125,25163
1/29/2022,2022,1,29,8,52444,11092,3237,24210
1/29/2022,2022,1,29,9,49916,7681,7268,23095
1/29/2022,2022,1,29,10,46897,5853,7479,22878
1/29/2022,2022,1,29,11,44105,7939,7407,20168
1/29/2022,2022,1,29,12,41779,9721,6785,17748
1/29/2022,2022,1,29,13,39866,9627,6583,16608
1/29/2022,2022,1,29,14,38583,8600,7257,15813
1/29/2022,2022,1,29,15,37955,8121,7750,15520
1/29/2022,2022,1,29,16,37918,7731,6891,16770
1/29/2022,2022,1,29,17,38674,7246,2584,20269
1/29/2022,2022,1,29,18,40901,7728,54,22704
1/29/2022,2022,1,29,19,41679,9321,0,22276
1/29/2022,2022,1,29,20,42027,12013,0,21253
1/29/2022,2022,1,29,21,42132,16134,0,19464
1/29/2022,2022,1,29,22,41713,17435,0,18248
1/29/2022,2022,1,29,23,45616,4739,0,17068
1/29/2023,2023,1,29,0,36730,18401,0,13603
1/29/2023,2023,1,29,1,35628,16065,0,13983
1/29/2023,2023,1,29,2,34931,14302,0,14674
1/29/2023,2023,1,29,3,34614,12745,0,15554
1/29/2023,2023,1,29,4,34501,13840,0,14469
1/29/2023,2023,1,29,5,34947,15463,0,14101
1/29/2023,2023,1,29,6,35754,14528,0,14798
1/29/2023,2023,1,29,7,37130,14140,19,15290
1/29/2023,2023,1,29,8,38788,15178,547,15385
1/29/2023,2023,1,29,9,41108,14596,1474,16579
1/29/2023,2023,1,29,10,42675,14493,2976,16966
1/29/2023,2023,1,29,11,43820,12749,4694,17638
1/29/2023,2023,1,29,12,44905,11322,5318,19182
1/29/2023,2023,1,29,13,45845,10996,5711,19779
1/29/2023,2023,1,29,14,46490,11366,5680,19921
1/29/2023,2023,1,29,15,47188,11581,5555,19779
1/29/2023,2023,1,29,16,47737,10977,4487,20991
1/29/2023,2023,1,29,17,48704,11127,1876,22980
1/29/2023,2023,1,29,18,50232,11935,26,24343
1/29/2023,2023,1,29,19,50737,12411,0,24584
1/29/2023,2023,1,29,20,50342,12971,0,23856
1/29/2023,2023,1,29,21,49549,12712,0,23905
1/29/2023,2023,1,29,22,47841,12606,0,22822
1/29/2023,2023,1,29,23,38148,20090,0,21401
1/29/2024,2024,1,29,0,42685,12144,0,18818
1/29/2024,2024,1,29,1,42513,13070,0,18286
1/29/2024,2024,1,29,2,42828,13656,0,18142
1/29/2024,2024,1,29,3,43662,13780,0,18506
1/29/2024,2024,1,29,4,45333,13670,0,19468
1/29/2024,2024,1,29,5,48485,13297,0,21600
1/29/2024,2024,1,29,6,52790,13013,0,24718
1/29/2024,2024,1,29,7,54805,11911,433,26970
1/29/2024,2024,1,29,8,53145,10363,7050,23276
1/29/2024,2024,1,29,9,50147,6761,14073,19666
1/29/2024,2024,1,29,10,47556,4514,14814,19014
1/29/2024,2024,1,29,11,45511,3465,14676,18530
1/29/2024,2024,1,29,12,44153,2515,14410,17966
1/29/2024,2024,1,29,13,43367,1835,14337,17656
1/29/2024,2024,1,29,14,42902,1779,14573,17420
1/29/2024,2024,1,29,15,42882,2078,14380,17477
1/29/2024,2024,1,29,16,43155,2181,11005,18892
1/29/2024,2024,1,29,17,44145,2708,3105,23097
1/29/2024,2024,1,29,18,46158,3757,156,26196
1/29/2024,2024,1,29,19,46233,4858,0,26015
1/29/2024,2024,1,29,20,45909,5831,0,25075
1/29/2024,2024,1,29,21,44947,6519,0,23799
1/29/2024,2024,1,29,22,42988,7529,0,21674
1/29/2024,2024,1,29,23,43517,10074,0,19760
1/3/2021,2021,1,3,0,40934,16445,0,16021
1/3/2021,2021,1,3,1,40240,16463,0,16142
1/3/2021,2021,1,3,2,39985,16183,0,16117
1/3/2021,2021,1,3,3,40193,16677,0,16290
1/3/2021,2021,1,3,4,40536,16891,0,16490
1/3/2021,2021,1,3,5,41381,16474,0,17355
1/3/2021,2021,1,3,6,42422,15945,0,18668
1/3/2021,2021,1,3,7,43926,15791,0,20088
1/3/2021,2021,1,3,8,44610,15514,113,20341
1/3/2021,2021,1,3,9,43637,13250,2411,20435
1/3/2021,2021,1,3,10,41737,9533,3557,20737
1/3/2021,2021,1,3,11,39809,7230,3558,20664
1/3/2021,2021,1,3,12,38426,6000,3460,19962
1/3/2021,2021,1,3,13,36927,5061,3440,19324
1/3/2021,2021,1,3,14,36100,4113,3568,19031
1/3/2021,2021,1,3,15,35283,3565,3645,18888
1/3/2021,2021,1,3,16,35410,3364,3461,20037
1/3/2021,2021,1,3,17,35989,3301,987,22420
1/3/2021,2021,1,3,18,38830,4403,2,23540
1/3/2021,2021,1,3,19,39812,6848,0,21666
1/3/2021,2021,1,3,20,39836,9344,0,19510
1/3/2021,2021,1,3,21,39529,11686,0,17734
1/3/2021,2021,1,3,22,38792,12922,0,16594
1/3/2021,2021,1,3,23,37343,13477,0,15501
1/3/2022,2022,1,3,0,48507,4907,0,26359
1/3/2022,2022,1,3,1,48267,5008,0,26181
1/3/2022,2022,1,3,2,48383,5128,0,26418
1/3/2022,2022,1,3,3,49061,5293,0,26756
1/3/2022,2022,1,3,4,50362,5672,0,27191
1/3/2022,2022,1,3,5,52623,6328,0,28215
1/3/2022,2022,1,3,6,55639,6559,0,29685
1/3/2022,2022,1,3,7,57623,7029,64,30070
1/3/2022,2022,1,3,8,57022,7639,2569,28433
1/3/2022,2022,1,3,9,54317,5750,6649,26359
1/3/2022,2022,1,3,10,51489,4225,7083,25507
1/3/2022,2022,1,3,11,48692,5174,6769,23696
1/3/2022,2022,1,3,12,46318,6505,6567,21409
1/3/2022,2022,1,3,13,44410,7276,6667,19148
1/3/2022,2022,1,3,14,42984,8050,6978,17513
1/3/2022,2022,1,3,15,42357,9179,6694,16582
1/3/2022,2022,1,3,16,42581,9580,4141,17885
1/3/2022,2022,1,3,17,44934,9629,569,21272
1/3/2022,2022,1,3,18,48097,13319,0,21751
1/3/2022,2022,1,3,19,49042,17740,0,20151
1/3/2022,2022,1,3,20,49360,20554,0,18424
1/3/2022,2022,1,3,21,48733,20722,0,17733
1/3/2022,2022,1,3,22,47183,20664,0,17038
1/3/2022,2022,1,3,23,49443,4850,0,16188
1/3/2023,2023,1,3,0,37047,21707,1,11473
1/3/2023,2023,1,3,1,35546,21121,1,10907
1/3/2023,2023,1,3,2,34754,20451,1,10769
1/3/2023,2023,1,3,3,34467,20100,1,10797
1/3/2023,2023,1,3,4,34740,19495,1,11307
1/3/2023,2023,1,3,5,36180,18922,1,12525
1/3/2023,2023,1,3,6,38485,17233,1,14135
1/3/2023,2023,1,3,7,40015,15849,32,15532
1/3/2023,2023,1,3,8,40472,15185,1001,15635
1/3/2023,2023,1,3,9,40752,12099,2861,16707
1/3/2023,2023,1,3,10,41282,11594,4168,16306
1/3/2023,2023,1,3,11,41887,11882,4786,16182
1/3/2023,2023,1,3,12,42313,10911,5102,17017
1/3/2023,2023,1,3,13,42801,10766,5469,17134
1/3/2023,2023,1,3,14,43071,10837,5592,17154
1/3/2023,2023,1,3,15,43315,10488,5813,17394
1/3/2023,2023,1,3,16,43479,10910,4615,17456
1/3/2023,2023,1,3,17,43444,9981,806,19943
1/3/2023,2023,1,3,18,44398,9892,0,21344
1/3/2023,2023,1,3,19,44018,11206,0,20383
1/3/2023,2023,1,3,20,42968,11977,0,19359
1/3/2023,2023,1,3,21,41477,12493,0,18173
1/3/2023,2023,1,3,22,39401,11957,0,17451
1/3/2023,2023,1,3,23,39014,21661,1,16468
1/3/2024,2024,1,3,0,45545,4584,0,25591
1/3/2024,2024,1,3,1,44534,4827,0,24737
1/3/2024,2024,1,3,2,44479,5408,0,24313
1/3/2024,2024,1,3,3,44566,6148,0,23569
1/3/2024,2024,1,3,4,45319,6041,0,24027
1/3/2024,2024,1,3,5,47350,6318,0,25104
1/3/2024,2024,1,3,6,49957,5937,0,26886
1/3/2024,2024,1,3,7,51736,6098,27,28280
1/3/2024,2024,1,3,8,52298,4777,1887,28435
1/3/2024,2024,1,3,9,52677,4149,5880,26512
1/3/2024,2024,1,3,10,52244,4067,7733,25047
1/3/2024,2024,1,3,11,50970,4044,8634,23516
1/3/2024,2024,1,3,12,49878,3829,8984,22516
1/3/2024,2024,1,3,13,48670,3556,9622,21414
1/3/2024,2024,1,3,14,47517,3403,9236,20875
1/3/2024,2024,1,3,15,47101,3432,8008,21219
1/3/2024,2024,1,3,16,47487,3612,5440,22468
1/3/2024,2024,1,3,17,49317,3810,971,26024
1/3/2024,2024,1,3,18,51140,5076,0,26855
1/3/2024,2024,1,3,19,51143,6930,0,25749
1/3/2024,2024,1,3,20,50833,8511,0,24304
1/3/2024,2024,1,3,21,49917,9783,0,22999
1/3/2024,2024,1,3,22,48192,10348,0,21638
1/3/2024,2024,1,3,23,46779,3932,0,20769
1/30/2021,2021,1,30,0,35410,20077,0,11969
1/30/2021,2021,1,30,1,34145,19638,0,11727
1/30/2021,2021,1,30,2,33483,19479,0,11474
1/30/2021,2021,1,30,3,33133,19449,0,11164
1/30/2021,2021,1,30,4,33037,19159,0,11222
1/30/2021,2021,1,30,5,33195,19162,0,11372
1/30/2021,2021,1,30,6,34090,19627,0,11318
1/30/2021,2021,1,30,7,35391,20942,0,11456
1/30/2021,2021,1,30,8,36705,21887,94,11793
1/30/2021,2021,1,30,9,37981,20821,2355,12379
1/30/2021,2021,1,30,10,38913,21261,1729,12357
1/30/2021,2021,1,30,11,38876,21009,1976,12133
1/30/2021,2021,1,30,12,38760,20792,2184,11838
1/30/2021,2021,1,30,13,38105,20457,2233,11978
1/30/2021,2021,1,30,14,37595,19661,1663,12170
1/30/2021,2021,1,30,15,37369,19181,1583,12529
1/30/2021,2021,1,30,16,37545,19199,1309,13049
1/30/2021,2021,1,30,17,37757,17154,1586,14566
1/30/2021,2021,1,30,18,38236,14195,230,17270
1/30/2021,2021,1,30,19,38924,13557,0,17236
1/30/2021,2021,1,30,20,38326,13192,0,16821
1/30/2021,2021,1,30,21,37510,13302,0,16458
1/30/2021,2021,1,30,22,36548,12098,0,16307
1/30/2021,2021,1,30,23,35046,11857,0,15711
1/30/2022,2022,1,30,0,40519,17952,0,16341
1/30/2022,2022,1,30,1,40250,17946,0,15895
1/30/2022,2022,1,30,2,40550,17640,0,16591
1/30/2022,2022,1,30,3,41078,17367,0,17417
1/30/2022,2022,1,30,4,41824,16098,0,19091
1/30/2022,2022,1,30,5,42913,13389,0,21119
1/30/2022,2022,1,30,6,44665,11927,0,22359
1/30/2022,2022,1,30,7,46401,10722,118,23590
1/30/2022,2022,1,30,8,46334,8929,3039,23035
1/30/2022,2022,1,30,9,44448,5201,6799,22521
1/30/2022,2022,1,30,10,42237,4198,7368,21968
1/30/2022,2022,1,30,11,40422,5087,7101,20848
1/30/2022,2022,1,30,12,39111,4949,6774,20288
1/30/2022,2022,1,30,13,38167,5982,6773,19218
1/30/2022,2022,1,30,14,37633,6987,6295,18481
1/30/2022,2022,1,30,15,37445,7405,5358,18457
1/30/2022,2022,1,30,16,37613,6999,4370,19511
1/30/2022,2022,1,30,17,38764,6867,1263,21521
1/30/2022,2022,1,30,18,40856,8107,22,22811
1/30/2022,2022,1,30,19,41424,10135,0,22104
1/30/2022,2022,1,30,20,40909,10892,0,21379
1/30/2022,2022,1,30,21,40244,10603,0,20967
1/30/2022,2022,1,30,22,38458,10452,0,19938
1/30/2022,2022,1,30,23,41007,17763,0,18226
1/30/2023,2023,1,30,0,44932,14641,0,19235
1/30/2023,2023,1,30,1,44636,15301,0,18482
1/30/2023,2023,1,30,2,44936,15258,0,18773
1/30/2023,2023,1,30,3,45727,14055,0,20328
1/30/2023,2023,1,30,4,47231,12917,0,22141
1/30/2023,2023,1,30,5,50060,11243,0,25169
1/30/2023,2023,1,30,6,54320,9472,0,28171
1/30/2023,2023,1,30,7,56537,7908,7,30162
1/30/2023,2023,1,30,8,57098,6796,213,30846
1/30/2023,2023,1,30,9,57998,6167,609,31490
1/30/2023,2023,1,30,10,58555,5548,1165,31790
1/30/2023,2023,1,30,11,59213,5353,1748,31860
1/30/2023,2023,1,30,12,59753,5172,2234,32146
1/30/2023,2023,1,30,13,60165,5170,2235,32375
1/30/2023,2023,1,30,14,60066,5249,1832,32620
1/30/2023,2023,1,30,15,60155,5061,1237,33090
1/30/2023,2023,1,30,16,60615,5042,704,33664
1/30/2023,2023,1,30,17,61661,5045,169,34354
1/30/2023,2023,1,30,18,62806,5153,1,35247
1/30/2023,2023,1,30,19,62424,5170,0,35167
1/30/2023,2023,1,30,20,61944,5450,0,34861
1/30/2023,2023,1,30,21,61170,6034,0,34053
1/30/2023,2023,1,30,22,59158,6356,0,32510
1/30/2023,2023,1,30,23,46050,13257,0,31014
1/30/2024,2024,1,30,0,40117,8509,0,19114
1/30/2024,2024,1,30,1,39557,8749,0,18733
1/30/2024,2024,1,30,2,39597,8657,0,18962
1/30/2024,2024,1,30,3,40341,8367,0,19606
1/30/2024,2024,1,30,4,41660,8052,0,20602
1/30/2024,2024,1,30,5,44733,7639,0,23012
1/30/2024,2024,1,30,6,48877,7248,0,25895
1/30/2024,2024,1,30,7,50750,5907,285,27189
1/30/2024,2024,1,30,8,49881,4695,5655,24475
1/30/2024,2024,1,30,9,47505,2622,12770,20692
1/30/2024,2024,1,30,10,45330,1145,14322,20009
1/30/2024,2024,1,30,11,43938,647,14115,19488
1/30/2024,2024,1,30,12,43204,389,13682,19373
1/30/2024,2024,1,30,13,43003,183,13752,19212
1/30/2024,2024,1,30,14,42949,169,13733,18962
1/30/2024,2024,1,30,15,42967,202,13149,19346
1/30/2024,2024,1,30,16,43362,312,9894,20799
1/30/2024,2024,1,30,17,44274,663,2789,24995
1/30/2024,2024,1,30,18,45658,1301,91,27377
1/30/2024,2024,1,30,19,45743,1853,0,27150
1/30/2024,2024,1,30,20,45303,2526,0,26419
1/30/2024,2024,1,30,21,44309,3537,0,25002
1/30/2024,2024,1,30,22,42441,4358,0,22775
1/30/2024,2024,1,30,23,41190,8250,0,20642
1/31/2021,2021,1,31,0,34004,11421,0,15903
1/31/2021,2021,1,31,1,33058,11539,0,14944
1/31/2021,2021,1,31,2,32824,13556,0,14067
1/31/2021,2021,1,31,3,32861,13934,0,13960
1/31/2021,2021,1,31,4,32997,14269,0,13132
1/31/2021,2021,1,31,5,33577,15639,0,13588
1/31/2021,2021,1,31,6,34684,15643,0,14631
1/31/2021,2021,1,31,7,36176,15989,0,15542
1/31/2021,2021,1,31,8,37687,16316,206,15727
1/31/2021,2021,1,31,9,38594,14251,3158,15137
1/31/2021,2021,1,31,10,39209,16271,4311,14142
1/31/2021,2021,1,31,11,38974,16626,4466,14256
